type,ticker,id,text,score,timestamp,parent_post_id
comment_in_dd,NVDA,m5pbf6g,#NVDA Gang members checking in,9,2025-01-06 14:50,1huwh0z
comment_in_dd,SPY,m5pcn70,SPY is on track for a 176% gain in 2025,8,2025-01-06 14:57,1huwh0z
comment_in_dd,NVDA,m5pdo0o,"#Ban Bet Won
---

/u/No-Calligrapher-3513 made a bet that NVDA would go to 150.0 within **4 weeks** when it was 133.63 and it did, congrats gigabrain.

Their record is now 3 wins and 2 losses
You're a part of the [WSB Discord server](http://discord.gg/wsbverse), therefore you earned 10,000 coins for your win!

[**Join WSB Discord**](http://discord.gg/wsbverse)",10,2025-01-06 15:03,1huwh0z
comment_in_dd,NVDA,m5pdoe3,NVDA market cap has added Bank of America's market cap in the last 2 trading sessions ![img](emote|t5_2th52|4271),9,2025-01-06 15:03,1huwh0z
comment_in_dd,NVDA,m5penfm,NVDA never going below 135 again ![img](emote|t5_2th52|4271)![img](emote|t5_2th52|4271)![img](emote|t5_2th52|4276)![img](emote|t5_2th52|4276)![img](emote|t5_2th52|4276)![img](emote|t5_2th52|4276)![img](emote|t5_2th52|4276),9,2025-01-06 15:08,1huwh0z
comment_in_dd,SPY,m5peo7v,"You'll find this hard to belive but I have paper handed my SPY 600C for a $ 600 profit. 


It just feels neat and tidy. ",9,2025-01-06 15:08,1huwh0z
comment_in_dd,NVDA,m5pfukh,Took profits on NVDA calls. 200 eod confirmed.,10,2025-01-06 15:15,1huwh0z
comment_in_dd,SPY,m5phtcx,"6k gain on SPY on market open 0DTE, eating steak tonight ![img](emote|t5_2th52|4276)![img](emote|t5_2th52|8882)",10,2025-01-06 15:26,1huwh0z
comment_in_dd,NVDA,m5pifud,"NVDA on the verge of crossing above AAPL market cap for #1 spot again.

And less than $300bn away from first $4 trillion market cap company ever.",9,2025-01-06 15:29,1huwh0z
comment_in_dd,NVIDIA,m5piilg,"""nViDiA wIlL nOt MaKe iT tO 150"" - words of the utterly daranged merely days ago",9,2025-01-06 15:29,1huwh0z
comment_in_dd,NVDA,m5pimfq,MAG 7 ripping today GOOGL AMAZON NVDA,9,2025-01-06 15:30,1huwh0z
comment_in_dd,NVDA,m5pw4dz,"The year is 2035 and NVDA market cap is unlimited. By decree of overlord Jensen, your everyday appliances will have a GPU powerful enough to play GTA 7.",9,2025-01-06 16:39,1huwh0z
comment_in_dd,SPY,m5px77s,This is why I get trapped into holding spy/q calls overnight. 80% of the move is done by 9:40am,8,2025-01-06 16:45,1huwh0z
comment_in_dd,SPY,m5pxj5j,"To everyone wondering about the SPY volume today we can make sense of it if we just think of the market as an ideal gas.  
  
PV=nRT  
  
V=nRT/P  
  
For volume to be down there must be an increase in selling pressure later today. It's basic science, you guys. Hope that helps.",8,2025-01-06 16:46,1huwh0z
comment_in_dd,SPY,m5q1b15,"#Ban Bet Lost

/u/latte2198 made a bet that SPY would go to 550.0 within **4 weeks** when it was 605.748 and it did not, so they were banned for a week.

Their record is now 1 wins and 16 losses

[**Join WSB Discord**](http://discord.gg/wsbverse)",9,2025-01-06 17:05,1huwh0z
comment_in_dd,TESLA,m5q5c29,"i would always think where being too harsh on cramer

but he went bullish on pltr and tesla..

and now theyre both legit red

its kind of amazing actually",8,2025-01-06 17:25,1huwh0z
comment_in_dd,SPY,m5q978w,SPY right back to 10AM price lmfao,9,2025-01-06 17:44,1huwh0z
comment_in_dd,TESLA,m5qgxlk,"Good lord I should never touch Tesla
I am the regard responsible for its red days",9,2025-01-06 18:21,1huwh0z
comment_in_dd,TSLA,m5qo29a,Let’s see those Tsla loss pron ![img](emote|t5_2th52|4258),8,2025-01-06 18:59,1huwh0z
comment_in_dd,TESLA,m5qql0j,"Shhhhh, don't fight it Tesla. Just slip under $400. You know it's where you belong.",9,2025-01-06 19:11,1huwh0z
comment_in_dd,SPY,m5qx0qs,Talk about a rug I bought SPY calls at 599.50 and it’s been a straight line down since,8,2025-01-06 19:42,1huwh0z
comment_in_dd,SPY,m5r0b5p,Spy might just go red,8,2025-01-06 19:58,1huwh0z
comment_in_dd,SPY,m5r3hwq,SPY you goddamn roach ![img](emote|t5_2th52|27421),8,2025-01-06 20:13,1huwh0z
comment_in_dd,NVDA,m5r6di7,Nvda 165 tomorrow,10,2025-01-06 20:27,1huwh0z
comment_in_dd,SPY,m5rajtk,Gonna hold 600 SPY calls overnight am I regarded?,9,2025-01-06 20:47,1huwh0z
comment_in_dd,NVDA,m5okxdq,NVDA heading to 160? Thoughts?,8,2025-01-06 11:30,1huwh0z
comment_in_dd,NVDA,m5omd40,Nvda 155?,7,2025-01-06 11:44,1huwh0z
comment_in_dd,NVDA,m5oozda,"HOOD, NVDA, AMD 🚀🚀🚀 pls",8,2025-01-06 12:07,1huwh0z
comment_in_dd,NVDA,m5orafx,NVDA 160 by end of day huh,8,2025-01-06 12:26,1huwh0z
comment_in_dd,SPY,m5orfw7,Today SPY will hit 600. Buy SPY calls at open,9,2025-01-06 12:28,1huwh0z
comment_in_dd,SPY,m5oxcf2,Spy to 606 ![img](emote|t5_2th52|12787)?,8,2025-01-06 13:13,1huwh0z
comment_in_dd,TESLA,m5p6lb4,lol tesla 420.69 sell wall,8,2025-01-06 14:18,1huwh0z
comment_in_dd,SPY,m5p6ov0,"Sir, a second 🥭 hit SPY.",8,2025-01-06 14:18,1huwh0z
comment_in_dd,SPY,m5p9ey3,My SPY puts getting obliterated ![img](emote|t5_2th52|4260),8,2025-01-06 14:36,1huwh0z
comment_in_dd,NVDA,m5pb7sq,Holy shit NVDA ![img](emote|t5_2th52|4271)![img](emote|t5_2th52|4271)![img](emote|t5_2th52|4271)![img](emote|t5_2th52|4276),7,2025-01-06 14:49,1huwh0z
comment_in_dd,NVDA,m5pbjyv,NVDA went from 134 to 150 in less than 3 trading days lmao,8,2025-01-06 14:51,1huwh0z
comment_in_dd,NVDA,m5623vi,"#Ban Bet Won
---

/u/Big_Angle154 made a bet that NVDA would go to 139.0 within **3 days** when it was 134.36 and it did, congrats autist.

Their record is now 2 wins and 0 losses

[**Join WSB Discord**](http://discord.gg/wsbverse)",32,2025-01-03 11:35,1hsjyo6
comment_in_dd,SPY,m56jc52,SPY 0dtes are the true world reserve currency,34,2025-01-03 13:49,1hsjyo6
comment_in_dd,SPY,m56o2c2,HOLY SHIT SPY 600 TODAY ![img](emote|t5_2th52|4258),20,2025-01-03 14:20,1hsjyo6
comment_in_dd,TSLA,m586emx,The Tsla call I paper handed for a loss earlier is now up 400% ![img](emote|t5_2th52|31225)![img](emote|t5_2th52|31225)![img](emote|t5_2th52|31225)![img](emote|t5_2th52|31225),20,2025-01-03 19:01,1hsjyo6
comment_in_dd,NVDA,m57tjxh,My NVDA puts ARE FUCKED,16,2025-01-03 17:58,1hsjyo6
comment_in_dd,SPY,m56a4fk,Spy green and port red. Fuck me,16,2025-01-03 12:44,1hsjyo6
comment_in_dd,NVDA,m56pbpq,"**BREAKING NEWS**

NVDA just said it’s gonna put the market on its back today",15,2025-01-03 14:27,1hsjyo6
comment_in_dd,SPY,m57j7xe,I just want one red SPY candle so i can offload at 70% loss instead of 90,16,2025-01-03 17:07,1hsjyo6
comment_in_dd,TSLA,m566x93,TSLA BAG HOLDERS SHOW YOURSELFS ![img](emote|t5_2th52|4271)![img](emote|t5_2th52|4267)![img](emote|t5_2th52|4267)![img](emote|t5_2th52|4267),15,2025-01-03 12:18,1hsjyo6
comment_in_dd,SPY,m578idi,DUMP IT SPY ![img](emote|t5_2th52|27421)![img](emote|t5_2th52|27421)![img](emote|t5_2th52|27421)![img](emote|t5_2th52|27421)![img](emote|t5_2th52|27421),14,2025-01-03 16:13,1hsjyo6
comment_in_dd,SPY,m57m3qk,sorry bears. i bought SPY puts. ![img](emote|t5_2th52|4260),13,2025-01-03 17:21,1hsjyo6
comment_in_dd,SPY,m57xevr,Smells like bull trap. Spy puts in an hour.,14,2025-01-03 18:17,1hsjyo6
comment_in_dd,NVDA,m582114,I sold my nvda 140 calls expiring today for 0.55 yesterday and today they’re at 4.75 🤡🤡🤡,13,2025-01-03 18:40,1hsjyo6
comment_in_dd,SPY,m566lgy,cant wait to yolo my tax return into spy dailies ![img](emote|t5_2th52|4271),13,2025-01-03 12:15,1hsjyo6
comment_in_dd,NVDA,m56knax,NVDA is the only safe play,14,2025-01-03 13:58,1hsjyo6
comment_in_dd,SPY,m57f83k,!banbet spy 586 4h,13,2025-01-03 16:47,1hsjyo6
comment_in_dd,SPY,m57hn2x,Y’all 0DTE spy regards are straight up degenerates ,13,2025-01-03 16:59,1hsjyo6
comment_in_dd,TSLA,m57wvux,Tsla double regard strength,13,2025-01-03 18:15,1hsjyo6
comment_in_dd,TSLA,m5850n1,bought 2 tsla 350 puts at open sold for a loss. bought 5 400 calls sold for a loss bought 30 385 puts...... looks like another loss. Im officially gay. Flair me as gay thanks,13,2025-01-03 18:54,1hsjyo6
comment_in_dd,TSLA,m58m12b,"# who the fuck is buying this crap 

# TSLA",14,2025-01-03 20:19,1hsjyo6
comment_in_dd,SPY,m56nxyb,"I’d fuck an old lady idgaf as long as she’s a 6 or above and won’t break a hip ![img](emote|t5_2th52|29637)

SPY 600",13,2025-01-03 14:19,1hsjyo6
comment_in_dd,NVDA,m57tfmi,"An educational tale about the dangers of being regarded:

Bagheld NVDA options for the past few weeks. Was up on them multiple times but like a regard I held because I knew that eventually a break above 140 would come. But after yesterday's rugpull I got fed up and sold for a $1300 loss. Not even 5 min after I sold NVDA started reversing and started going back to 138 ![img](emote|t5_2th52|31225). So I bought back in ![img](emote|t5_2th52|8882). Now I'm up 4k but would've been up close to 10k if I held my original calls  ![img](emote|t5_2th52|31225)![img](emote|t5_2th52|27421)![img](emote|t5_2th52|27421)![img](emote|t5_2th52|27421)![img](emote|t5_2th52|27421)",13,2025-01-03 17:58,1hsjyo6
comment_in_dd,TSLA,m581ejh,TSLA literally makes zero sense....,12,2025-01-03 18:37,1hsjyo6
comment_in_dd,SPY,m56a2v7,SPY poised to open slightly higher. But you know what happens after 10:30am! The sellers appear,11,2025-01-03 12:44,1hsjyo6
comment_in_dd,SPY,m56mzg4,"Imagine being under 6ft tall ![img](emote|t5_2th52|4271)

SPY 600",12,2025-01-03 14:13,1hsjyo6
comment_in_dd,NVDA,m56ncrz,NVDA pls dont sell off at open (i know u will you bitch),11,2025-01-03 14:15,1hsjyo6
comment_in_dd,SPY,m57glzb,Spy has a wild ability to do something hilarious right now,11,2025-01-03 16:54,1hsjyo6
comment_in_dd,NVDA,m57um8t,There are millions of stocks to short and Bers chose NVDA![img](emote|t5_2th52|4271)![img](emote|t5_2th52|4267),11,2025-01-03 18:03,1hsjyo6
comment_in_dd,TESLA,m58a19z,My Tesla puts t_t,12,2025-01-03 19:19,1hsjyo6
comment_in_dd,TSLA,m58fe9e,"One of the hardest things for me as a trader is accepting a loss and closing the position, because so many times the stock will begin to move in my favor once I sell. But taking that 50% loss is always better than watching it go to 0 out of spite. With that said I’m feeling very thankful I sold my TSLA puts for a loss a few hours ago.",11,2025-01-03 19:45,1hsjyo6
comment_in_dd,NVDA,m566kl9,I really miss pre-split NVDA. Hasnt been the same since. ![img](emote|t5_2th52|4260),10,2025-01-03 12:15,1hsjyo6
comment_in_dd,NVDA,m56fs7y,"Hey NVDA, how about you pass 140 today and then shoot to ATHs, thank you.",9,2025-01-03 13:25,1hsjyo6
comment_in_dd,NVDA,m56vtmd,NVDA gang checking in.,9,2025-01-03 15:05,1hsjyo6
comment_in_dd,SPY,m573inw,SPY repeatedly trying to get up and falling down like nana in front of her CRT television with no remote,9,2025-01-03 15:47,1hsjyo6
comment_in_dd,SPY,m574mat,Flipped SPY calls into puts and lost all gains. Rip,9,2025-01-03 15:53,1hsjyo6
comment_in_dd,TESLA,m575gym,"Tesla Q4 down, Ford Q4 up. The world is less gay now.",10,2025-01-03 15:57,1hsjyo6
comment_in_dd,SPY,m57lyx6,I feel like SPY is coiling for a big move upwards right now. Mostly because my calls depend on it.,10,2025-01-03 17:21,1hsjyo6
comment_in_dd,"TSLA,TESLA",m57p42g,"""Why Tesla (TSLA) May Need To Stop Selling Cars To Hit $10k Per Share"" 

--headline on Yahoo finance. Absolute insanity.",10,2025-01-03 17:36,1hsjyo6
comment_in_dd,SPY,m57qxt4,"the ""big brains"" of wsb always chirp ""stop buying 0dtes you regards, buy further out""

so on tuesday, i bought a bunch of spy 600c for the following year

01/02/25...",11,2025-01-03 17:45,1hsjyo6
comment_in_dd,TESLA,m57un2m,"Judging by Tesla swing, this rally is built on sand.",10,2025-01-03 18:03,1hsjyo6
comment_in_dd,NVDA,m57vuf1,This sub is the dumbest of the dumb. Not even a couple days ago people were saying NVDA was on it's way to 120 and not breaking 140 for a long time and now it's almost at 145 ![img](emote|t5_2th52|4271). Never trust what anyone says on this regarded sub.,11,2025-01-03 18:09,1hsjyo6
comment_in_dd,TESLA,m580qrd,I sold Tesla calls for $880 lost and bought Aapl calls. Hahahaha fuck me,10,2025-01-03 18:34,1hsjyo6
comment_in_dd,TSLA,m5835ta,Tsla just had terrible deliveries so let's buy the dip ![img](emote|t5_2th52|4271)![img](emote|t5_2th52|4271),9,2025-01-03 18:45,1hsjyo6
comment_in_dd,TESLA,m587n00,"Boys boys remember the TESLA $492 PLAY COSTING $1400 I gave yesterday 
It's now $10,000 gains😂",10,2025-01-03 19:07,1hsjyo6
comment_in_dd,SPY,m588zz2,SPY 600 EOD and I crank everyone off,10,2025-01-03 19:14,1hsjyo6
comment_in_dd,TSLA,m58a20a,TSLA exists solely to bring pain to both bears and bulls.,11,2025-01-03 19:19,1hsjyo6
comment_in_dd,SPY,m58b922,SPY is looking real something right now,10,2025-01-03 19:25,1hsjyo6
comment_in_dd,TSLA,m58g8xn,TSLA should just stop selling cars so nobody has to see their declining growth and they can hit $2 trillion ![img](emote|t5_2th52|4271),10,2025-01-03 19:50,1hsjyo6
comment_in_dd,TSLA,m58n2ql,TSLA some absolute clown shit ![img](emote|t5_2th52|4271)![img](emote|t5_2th52|4267),10,2025-01-03 20:24,1hsjyo6
comment_in_dd,SPY,m56bbrf,Spy 590 today?? ![img](emote|t5_2th52|18630)![img](emote|t5_2th52|18630),10,2025-01-03 12:53,1hsjyo6
comment_in_dd,SPY,m56bztc,Guys I’m scared. Tempted to buy SPY puts![img](emote|t5_2th52|31225),9,2025-01-03 12:58,1hsjyo6
comment_in_dd,NVDA,m56f5fl,Is it me or is NVDA about to go on a massive run ??,8,2025-01-03 13:21,1hsjyo6
comment_in_dd,NVIDIA,m56mho5,Nvidia abt to touch 140 in premarket? It’s gonna be a bad day bulls ![img](emote|t5_2th52|4260)![img](emote|t5_2th52|4260)![img](emote|t5_2th52|4260),9,2025-01-03 14:10,1hsjyo6
comment_in_dd,SPY,m56mron,SPY has been bouncing like a penny stock for days. I’m tired of it,9,2025-01-03 14:12,1hsjyo6
comment_in_dd,SPY,m56rnep,0dte spy 580 puts here will print generational wealth,8,2025-01-03 14:41,1hsjyo6
comment_in_dd,NVDA,m56u7he,NVDA TO THE MOON MOTHERFUCKING BASTARDS 🚀🚀🚀🚀🚀🚀🚀,9,2025-01-03 14:56,1hsjyo6
comment_in_dd,NVDA,m56udgk,NVDA 140c absolutely printing ![img](emote|t5_2th52|4276)🚀🚀,9,2025-01-03 14:57,1hsjyo6
comment_in_dd,NVDA,m56uhzm,"#Ban Bet Won
---

/u/Active-Direction-793 made a bet that NVDA would go to 143.57 within **2 weeks** when it was 134.28 and it did, congrats regard.

Their record is now 1 wins and 3 losses

[**Join WSB Discord**](http://discord.gg/wsbverse)",9,2025-01-03 14:58,1hsjyo6
comment_in_dd,NVDA,m56uzew,Will nvda finally hold above $140 today? Is this finally fucking it?,9,2025-01-03 15:00,1hsjyo6
comment_in_dd,NVDA,m56w8nx,Time for the annual nvda winter festival. It’s gonna pump for months,10,2025-01-03 15:08,1hsjyo6
comment_in_dd,SPY,m56x0ks,Goes down faster than goes up fuck you spy you ruined my life![img](emote|t5_2th52|4260)![img](emote|t5_2th52|4267),10,2025-01-03 15:12,1hsjyo6
comment_in_dd,SPY,m5781me,"#SPY IS ALL BARRED OUT

#SEA OF RED COMING",9,2025-01-03 16:10,1hsjyo6
comment_in_dd,SPY,m578lyt,SPY never had the makings of a varsity athlete.,8,2025-01-03 16:13,1hsjyo6
comment_in_dd,TESLA,m57dqs3,"“Why is everything ripping” because we’ve been dumping for the past week. Tesla being down more than 100 points should have been the signal. 

Did you really expect it to go down forever, you dumb, idiot, poor, neglected, fatherless, kitchen soup, -99% port fucking regard ber?",9,2025-01-03 16:39,1hsjyo6
comment_in_dd,SPY,m57e80e,Spy is basically going to touch 592 after lunch ![img](emote|t5_2th52|8883),9,2025-01-03 16:42,1hsjyo6
comment_in_dd,NVDA,m57gjak,"Jesus fuck nvda calls up 11,000% this week",9,2025-01-03 16:53,1hsjyo6
comment_in_dd,NVDA,m57p6vf,finally up 1k on nvda after being down -6k for a month ![img](emote|t5_2th52|4271),9,2025-01-03 17:37,1hsjyo6
comment_in_dd,TSLA,m57s2ru,"bought TSLA calls just few minutes ago, the top is IN",8,2025-01-03 17:51,1hsjyo6
comment_in_dd,TSLA,m584d3r,"TSLA valuation used to be 30% car sales, 70% hopium.
Now its 10% car sales and 90% hopium.
Buying back those 400p.",9,2025-01-03 18:51,1hsjyo6
comment_in_dd,TESLA,m586ro6,GOD DAMN TESLA ON A SICK ONE TODAY,10,2025-01-03 19:03,1hsjyo6
comment_in_dd,TESLA,m587dyo,Um why is Tesla still going up,10,2025-01-03 19:06,1hsjyo6
comment_in_dd,TSLA,m5891yv,I guess TSLA puts were not the move today ![img](emote|t5_2th52|4260),10,2025-01-03 19:14,1hsjyo6
comment_in_dd,TESLA,m58q3ui,"Tesla gained 3 Ford Market Cap’s worth of value today because they are going to miss on deliveries.

This stock is fucking dumb",11,2025-01-03 20:40,1hsjyo6
comment_in_dd,TESLA,m58qzbp,So why is Tesla almost up 10% today guys,11,2025-01-03 20:44,1hsjyo6
comment_in_dd,NVDA,m58wb38,Bers gonna have a lot of catching up to do from shorting NVDA  — meanwhile all the bulls will be banging their six AI wives ![img](emote|t5_2th52|8882),9,2025-01-03 21:11,1hsjyo6
comment_in_dd,SPY,m561ktx,My SPY calls are finished,7,2025-01-03 11:30,1hsjyo6
comment_in_dd,TSLA,m566pdo,TSLA puts finally going to print,9,2025-01-03 12:16,1hsjyo6
comment_in_dd,SPY,m56oeug,for every 5 dollars spy goes up AMD goes up 30 cents ![img](emote|t5_2th52|8882),8,2025-01-03 14:22,1hsjyo6
comment_in_dd,SPY,m56olz8,I'm thinking SPY588C and blow up my last 600 dollars or turn it into 700. ,7,2025-01-03 14:23,1hsjyo6
comment_in_dd,SPY,m56q9ya,![img](emote|t5_2th52|4267) My SPY puts at open,9,2025-01-03 14:33,1hsjyo6
comment_in_dd,NVDA,m56sjr4,#NVDA Gang members checking in,9,2025-01-03 14:46,1hsjyo6
comment_in_dd,SPY,m56u7vr,Wsb so bearish… spy mooning mid day,7,2025-01-03 14:56,1hsjyo6
comment_in_dd,SPY,m56ur6z,Apple is single handled keeping spy from going berserk with the rest of tech fuck this shit stock,8,2025-01-03 14:59,1hsjyo6
comment_in_dd,SPY,m56wqxo,Bears should loose all their money if spy closes above 590.70 today,9,2025-01-03 15:10,1hsjyo6
comment_in_dd,SPY,m56xy0s,I just saw the SPY manager at 7-11 and he put a cigarette out in his eyeball. NFA,8,2025-01-03 15:17,1hsjyo6
comment_in_dd,SPY,m5738ri,3 amigos formation on SPY about to get deported back to 580 today,9,2025-01-03 15:45,1hsjyo6
comment_in_dd,SPY,m574ef3,just bought SPY puts and feel like this is a trap.,8,2025-01-03 15:52,1hsjyo6
comment_in_dd,SPY,m576apz,"SPY just dump, its about that time ![img](emote|t5_2th52|4260)",7,2025-01-03 16:01,1hsjyo6
comment_in_dd,TESLA,m57e2n6,Show yourself people who bought puts for Tesla after a -18% week ![img](emote|t5_2th52|4271)![img](emote|t5_2th52|4271)![img](emote|t5_2th52|4271),8,2025-01-03 16:41,1hsjyo6
comment_in_dd,SPY,m57e3ma,Can we have a 2% day today SPY? ![img](emote|t5_2th52|18630),7,2025-01-03 16:41,1hsjyo6
comment_in_dd,SPY,m57fc88,"Spy even greener, corn even greener

HOOD —> “I’ll think about it”",7,2025-01-03 16:47,1hsjyo6
comment_in_dd,NVDA,m57iowq,"Father God, I thank you for letting me be born as an NVDA bull ![img](emote|t5_2th52|8882)![img](emote|t5_2th52|4276)",7,2025-01-03 17:04,1hsjyo6
comment_in_dd,SPY,m57llfp,Spy got a lot of runway to go down,8,2025-01-03 17:19,1hsjyo6
comment_in_dd,SPY,m57m9l4,SPY went up 1% and you bought calls ![img](emote|t5_2th52|4271),8,2025-01-03 17:22,1hsjyo6
comment_in_dd,SPY,m57mb3z,bro we obviously cant hold can spy just dump and bring us to Clifford the big red dog,9,2025-01-03 17:22,1hsjyo6
comment_in_dd,TSLA,m57n3fa,"TSLA intraday double top forming. If it doesn’t clear 400, it’s going back down to sub 350. You heard it here 1st. ![img](emote|t5_2th52|8882)",8,2025-01-03 17:26,1hsjyo6
comment_in_dd,SPY,m57nb6w,SPY about to shit the bed. $587 EOD.,8,2025-01-03 17:27,1hsjyo6
comment_in_dd,NVDA,m57vgly,Sold my NVDA calls yesterday at the exact bottom and it rips 4% today. The market hates my guts.,8,2025-01-03 18:08,1hsjyo6
comment_in_dd,TSLA,m57wm9a,never doubt tsla regard strength,9,2025-01-03 18:13,1hsjyo6
comment_in_dd,SPY,m580xsr,SPY is being a cock tease here... don't just lick it a bit... take the whole damn thing in your mouth,9,2025-01-03 18:34,1hsjyo6
comment_in_dd,SPY,m581bcg,Piece of shit spy couldn't do this yesterday? On a completely unrelated note. I have some dumpster availability for this weekend. ![img](emote|t5_2th52|52627),8,2025-01-03 18:36,1hsjyo6
comment_in_dd,TSLA,m581net,TSLA 500 eom ![img](emote|t5_2th52|4267)![img](emote|t5_2th52|4271),8,2025-01-03 18:38,1hsjyo6
comment_in_dd,TSLA,m581rnv,TSLA calls ![img](emote|t5_2th52|8882),8,2025-01-03 18:39,1hsjyo6
comment_in_dd,SPY,m583hmg,I’m boutta goon during takeoff to help my fellow bulls with getting SPY to 600 ![img](emote|t5_2th52|4276)![img](emote|t5_2th52|4276)![img](emote|t5_2th52|4276)![img](emote|t5_2th52|4276)![img](emote|t5_2th52|4276) thank me later behind the Wendy’s,9,2025-01-03 18:47,1hsjyo6
comment_in_dd,SPY,m5847jc,Lmao every time I look at SPY I can hear the bers crying,8,2025-01-03 18:50,1hsjyo6
comment_in_dd,SPY,m585g8m,this low ass volume on spy sucks ass,7,2025-01-03 18:56,1hsjyo6
comment_in_dd,SPY,m581460,I have SPY puts ![img](emote|t5_2th52|4260),18,2025-01-03 18:35,1hsjyo6
comment_in_dd,SPY,m4zqgwj,"assuming 10% growth on spy per month, we are looking at spy 1900 by end of 2025.

the roaring 20's restart in 3 hours 26 minutes.",60,2025-01-02 11:03,1hrr7uj
comment_in_dd,SPY,m50hjed,"SPY dump at open

very fresh. very original. has literally happened every day this year",40,2025-01-02 14:37,1hrr7uj
comment_in_dd,TSLA,m4zqps1,Full porting tsla puts ![img](emote|t5_2th52|27421),35,2025-01-02 11:06,1hrr7uj
comment_in_dd,TESLA,m50dt3r,# some tesla bul: MISSING DELIVERIES IS BULLISH 🤡🤡🤡🤡🤡,34,2025-01-02 14:14,1hrr7uj
comment_in_dd,TESLA,m50dji4,Die tesla die. Overpriced garbage with no resell value.,30,2025-01-02 14:12,1hrr7uj
comment_in_dd,SPY,m508hcq,Tax harvesting is over boys the coke heads are back in the office! Spy to 600 today,33,2025-01-02 13:38,1hrr7uj
comment_in_dd,TSLA,m50cxxw,"ackshully cybertruck contained the explosion 🤓 

loool fuck TSLA",28,2025-01-02 14:08,1hrr7uj
comment_in_dd,TSLA,m50dwre,TSLA is just a car company again.,32,2025-01-02 14:15,1hrr7uj
comment_in_dd,SPY,m51phn5,I say SPY 400 by end of year ![img](emote|t5_2th52|27189),30,2025-01-02 18:28,1hrr7uj
comment_in_dd,SPY,m51p5xm,SPY opening at 590 tmrw,23,2025-01-02 18:27,1hrr7uj
comment_in_dd,TESLA,m50d2ht,Is it insider trading if I know my friend is gonna set off a bunch of fireworks inside his Tesla and I buy puts,23,2025-01-02 14:09,1hrr7uj
comment_in_dd,TESLA,m50et52,Literally bought Tesla at the top lol. Insane,19,2025-01-02 14:20,1hrr7uj
comment_in_dd,SPY,m4zvtvw,Bro why is SPY rallying 1% before open,18,2025-01-02 11:56,1hrr7uj
comment_in_dd,"TSLA,TESLA",m51357o,"BREAKING: JIM CRAMER SAYS — $TSLA STOCK WILL BE “LOVED” IN 2025 👀

Tesla stock to $100 ?",17,2025-01-02 16:37,1hrr7uj
comment_in_dd,TSLA,m51pn2c,The 1w chart on TSLA is absolutely glorious!,22,2025-01-02 18:29,1hrr7uj
comment_in_dd,SPY,m51pbbu,SPY saw how boastful bulls were premarket and decided to say fuck you,17,2025-01-02 18:28,1hrr7uj
comment_in_dd,SPY,m5235kk,"SO YOU ARE TELLING ME BUYING 60K OF SPY @ 600 ON MARGIN WAS NOT SMART?

OKAY",17,2025-01-02 19:42,1hrr7uj
comment_in_dd,SPY,m51e724,"#CONGRATULATIONS ALL SHORT SELLERS, DEADCAT SHORTERS, PUT HOLDERS, SPY HATERS AND ALL OTHER BEARS! 🐻🐻🐻 YET ANOTHER ABSOLUTELY BEAUTIFUL DAILY LOW! 📉📉📉 TOGETHER WE WILL BRING THIS PONZI CLOWN GHEY MARKET TO AN END!!! 🐻🔪🌈🇺🇸🤡🐂🐖🩸🩸🩸

#HAPPY NEW 2025 YEAR!!! 🥳🥳🥳🍾🍾🍾🥂🥂🥂

#🎇🎆🎊🎉🎁",18,2025-01-02 17:33,1hrr7uj
comment_in_dd,SPY,m503g9s,SPY 0dte 600$ call 💰we about to print 👅👅👅🥵🥵,15,2025-01-02 13:02,1hrr7uj
comment_in_dd,SPY,m507ykt,Spy 600 and I’ll amber heard the bed,14,2025-01-02 13:35,1hrr7uj
comment_in_dd,SPY,m508ech,"taking dabs drinking coffee watching SPY move up

New year ain’t to bad yet ![img](emote|t5_2th52|4258)",15,2025-01-02 13:38,1hrr7uj
comment_in_dd,TSLA,m50djxg,TSLA has no right to be over 300 tbh.,15,2025-01-02 14:12,1hrr7uj
comment_in_dd,"SPY,TSLA",m50dtd3,"Damn it TSLA, could have been a 4% day on SPY

![img](emote|t5_2th52|4260)![img](emote|t5_2th52|31226)",14,2025-01-02 14:14,1hrr7uj
comment_in_dd,SPY,m50p6np,Who bought spy calls at top ✋,15,2025-01-02 15:22,1hrr7uj
comment_in_dd,SPY,m525wpr,If spy breaks 584 I am beyond fked on my puts,15,2025-01-02 19:55,1hrr7uj
comment_in_dd,SPY,m508t97,spy calls on open ?,14,2025-01-02 13:41,1hrr7uj
comment_in_dd,"SPY,TSLA",m50fdr4,Fucking TSLA taking spy down,14,2025-01-02 14:24,1hrr7uj
comment_in_dd,TESLA,m50j730,fuck tesla fuck elon,15,2025-01-02 14:48,1hrr7uj
comment_in_dd,SPY,m51fwwa,Forgot my RH password…how are my spy 600 odte calls doin,14,2025-01-02 17:42,1hrr7uj
comment_in_dd,TSLA,m50e3ra,"First trading day of the year, and TSLA shits the bed. ![img](emote|t5_2th52|31225)",13,2025-01-02 14:16,1hrr7uj
comment_in_dd,TESLA,m50e8ec,Tesla making me sick. I’m such an idiot,13,2025-01-02 14:17,1hrr7uj
comment_in_dd,SPY,m50fr6y,"I just tossed a coin... SPY is going up today, you heard it here first! ![img](emote|t5_2th52|4276)",13,2025-01-02 14:26,1hrr7uj
comment_in_dd,TSLA,m5105lz,"I'm a bull, but TSLA bulls are a special type of regard.

No like seriously, next level spectrum type shit. Donating their brains to science would be more beneficial to society than TSLA ever will be.",12,2025-01-02 16:21,1hrr7uj
comment_in_dd,TESLA,m51mvbv,"What happened to all the tesla dickriders from last night? Show your losses, please ![img](emote|t5_2th52|29637)",13,2025-01-02 18:16,1hrr7uj
comment_in_dd,TSLA,m51ok78,"TSLA touched ATH and market went into correction just like 2021. ![img](emote|t5_2th52|31225)

We need to stop meme stonks getting to ATH. ![img](emote|t5_2th52|31226)",14,2025-01-02 18:24,1hrr7uj
comment_in_dd,SPY,m52f1sf,SPY is gonna rally hard the next few weeks…its just science,13,2025-01-02 20:41,1hrr7uj
comment_in_dd,SPY,m504x2k,"If this goes Green to Red today

Load up $550 spy puts for march, we will be heading down",11,2025-01-02 13:13,1hrr7uj
comment_in_dd,TESLA,m50dpwr,Tesla valued like a crazy growth stock but has 2 years of basically no growth and growing competition with a CEO who half the country hates. This may be the best short of 2025,13,2025-01-02 14:13,1hrr7uj
