type,ticker,id,text,score,timestamp,parent_post_id
comment_in_dd,TSLA,mhq4a7a,Im starting to feel like some of you aren't even gambling but just want tsla to go down cause you hate it![img](emote|t5_2th52|4271),175,2025-03-14 10:32,1jb0bwm
comment_in_dd,SPY,mhr49b8,"lowest consumer confidence since 2022, SPY up 1%. ![img](emote|t5_2th52|31226)",62,2025-03-14 14:28,1jb0bwm
comment_in_dd,TSLA,mhq49tj,I would risk my entire portfolio to see TSLA burn to 0 ![img](emote|t5_2th52|27189),57,2025-03-14 10:32,1jb0bwm
comment_in_dd,TESLA,mhq3hby,"We only get market stability when tesla is at 50.

Its a POS company with -50% sales heaviky weighted  to the index.",50,2025-03-14 10:25,1jb0bwm
comment_in_dd,TESLA,mhqbheg,Baltimore gave up Tesla cop cars for FORD,42,2025-03-14 11:33,1jb0bwm
comment_in_dd,TESLA,mhq4eih,"If the europoors just banned Tesla this trade war could end, Don would fold and we’d finally rip",36,2025-03-14 10:34,1jb0bwm
comment_in_dd,TESLA,mhqbszc,All these puff piece articles about Tesla being an investment opportunity remind me of the scene in the big short when the Bear Stearns guy is advocating the housing market is strong while his stock plummets,35,2025-03-14 11:35,1jb0bwm
comment_in_dd,TSLA,mhqeqet,I somehow ended up with full port TSLA puts ![img](emote|t5_2th52|4271),33,2025-03-14 11:57,1jb0bwm
comment_in_dd,TSLA,mhs2bxu,"If TSLA dumps to beneath 240, I'll suck every dick in this sub",32,2025-03-14 17:13,1jb0bwm
comment_in_dd,TESLA,mhqbaag,"""Elon Musk’s Tesla has warned that Turnip’s trade war could expose the electric carmaker to retaliatory tariffs that would also affect other automotive manufacturers in the US.

In an unsigned letter to Jamieson Greer, the US trade representative, Tesla said it “supports fair trade” but that the US administration should ensure it did not “inadvertently harm US companies”.

The irony.",27,2025-03-14 11:31,1jb0bwm
comment_in_dd,TSLA,mhqjcpp,fuck TSLA,28,2025-03-14 12:29,1jb0bwm
comment_in_dd,TESLA,mhqs3ov,"Tesla is hated worldwide, has -50% car sales, protests in front of their stores, and people are still buying this stock. Regards ![img](emote|t5_2th52|4271)![img](emote|t5_2th52|4271)",31,2025-03-14 13:22,1jb0bwm
comment_in_dd,TESLA,mhquien,"Tesla bombs earnings and sales are down 50+% in key markets - down 10%. 

Trump buys a Tesla and does a photo shoot with it- back up 10%. 

Such is the enigma with Tesla. They can bomb every single earnings estimate, miss every single self-set goal, have zero growth as a “high growth tech stock”, but any even theoretically, vaguely positive event that may or may not even help them specifically still causes the stock to rocket back.  ",29,2025-03-14 13:36,1jb0bwm
comment_in_dd,TESLA,mhsjdy2,"Only Tesla could drop -15% in one day and be green again by the end of the week, all on bad news. Unbelievable.",31,2025-03-14 18:40,1jb0bwm
comment_in_dd,TSLA,mhq8lba,Logically explain to me how TSLA P/E is 5x GOOG and that the stock price should keep going up. I’ll wait![img](emote|t5_2th52|12787),27,2025-03-14 11:10,1jb0bwm
comment_in_dd,TSLA,mhqi208,TSLAs letter warning of impacts of tariffs was sent anonymously so no one loses their job ![img](emote|t5_2th52|4271)  Dystopian crazy bs ![img](emote|t5_2th52|4267)![img](emote|t5_2th52|4271)Elon to 0,26,2025-03-14 12:20,1jb0bwm
comment_in_dd,TSLA,mhr2cbm,Can tsla just fucking die already holy fuck,27,2025-03-14 14:18,1jb0bwm
comment_in_dd,SPY,mhs81ne,Wouldn’t it be cool if SPY dropped 2% rn ?,27,2025-03-14 17:40,1jb0bwm
comment_in_dd,SPY,mhs21p6,"Of course, spy goes up today. Just yesterday, I bought 3k worth puts, which vanished from portfolio immediately",27,2025-03-14 17:11,1jb0bwm
comment_in_dd,TSLA,mhqy033,"Why is TSLA fighting? Just die, bby",23,2025-03-14 13:55,1jb0bwm
comment_in_dd,"TSLA,TESLA",mhslb93,"Monday news: Tesla has only sold 1 car in 2025

TSLA +13% ![img](emote|t5_2th52|4271)![img](emote|t5_2th52|4271)![img](emote|t5_2th52|4271)![img](emote|t5_2th52|4271)![img](emote|t5_2th52|4271)",22,2025-03-14 18:49,1jb0bwm
comment_in_dd,TESLA,mhqxl3q,Watching Tesla open a fairly healthy green and then gradually turn to red within 30 minutes is now the only way my body can produce serotonin,22,2025-03-14 13:53,1jb0bwm
comment_in_dd,TSLA,mhqy88o,"oh well, at least TSLA is barely green...",24,2025-03-14 13:56,1jb0bwm
comment_in_dd,TSLA,mhrafd7,"Reasons why tsla will make a recovery to $400:

1. I've got puts

2. 

3.",23,2025-03-14 14:58,1jb0bwm
comment_in_dd,SPY,mhruac3,"Okay $SPY, you had your fun

Get the fuck back to 552",21,2025-03-14 16:34,1jb0bwm
comment_in_dd,TESLA,mhruohk,Fuck Tesla dude.,24,2025-03-14 16:36,1jb0bwm
comment_in_dd,SPY,mhs4lcm,"Banbet! SPY -2% EOD

I need a break",24,2025-03-14 17:24,1jb0bwm
comment_in_dd,TESLA,mhqpcay,Hmm Tesla still about $217 too high,19,2025-03-14 13:06,1jb0bwm
comment_in_dd,TESLA,mhsh4zi,# [ Tesla is done in Germany: 94% say they won't buy a Tesla car ](https://electrek.co/2025/03/14/tesla-is-done-in-germany-94-say-they-wont-buy-a-tesla-car/),19,2025-03-14 18:28,1jb0bwm
comment_in_dd,TESLA,mhq3s59,"*Europeans literally setting Tesla vehicles on fire*


Market: Believe it or not, calls",21,2025-03-14 10:28,1jb0bwm
comment_in_dd,"SPY,TSLA",mhq456g,I am Mr Bull and I don’t mind if SPY is down 2% as long as TSLA is down 10%,20,2025-03-14 10:31,1jb0bwm
comment_in_dd,TSLA,mhq4xzo,Who's pumping TSLA with taxpayer money? Target price $25 EOY.,17,2025-03-14 10:38,1jb0bwm
comment_in_dd,TESLA,mhqhnpz,"Sure, Tesla’s P/E is high. Yes, sales are dropping world wide. But you’ve got to consider the most important factor… everything is computer!",18,2025-03-14 12:18,1jb0bwm
comment_in_dd,SPY,mhqqtzh,"SPY encounters a random tariff.

SPY is surprised!!!

A random tariff attacks SPY!

Random tariff deal -2% damage to SPY!",19,2025-03-14 13:15,1jb0bwm
comment_in_dd,"TSLA,TESLA",mhqtled,"""Tesla dumped by Danish pension over labor rights, Musk actions""

""Elon Musk's Tesla says it could be targeted by retaliatory tariffs""

TSLA up ![img](emote|t5_2th52|8883)lol",20,2025-03-14 13:31,1jb0bwm
comment_in_dd,TSLA,mhqu0mt,If you are someone who is buying shares of TSLA with the intention of holding them for years you are truly too stupid to argue with,17,2025-03-14 13:33,1jb0bwm
comment_in_dd,TESLA,mhqu1r9,"# Tesla price target lowered to $120 from $135 at JPMorgan

  


Tesla pump, I don't understand economics, it's time to return to Wendys ![img](emote|t5_2th52|31226)",17,2025-03-14 13:33,1jb0bwm
comment_in_dd,TSLA,mhquk7e,TSLA always traps the low iq regards like this ![img](emote|t5_2th52|4271),18,2025-03-14 13:36,1jb0bwm
comment_in_dd,TSLA,mhr0v9v,TSLA seconds away from Red 🌈🌈🌈🎉🎉🎉,19,2025-03-14 14:10,1jb0bwm
comment_in_dd,SPY,mhrcxiz,SPY will dump below 555 EOD,19,2025-03-14 15:11,1jb0bwm
comment_in_dd,SPY,mhrq7un,I’ll cry real tears of joy if spy tanks the rest of the day,18,2025-03-14 16:15,1jb0bwm
comment_in_dd,SPY,mhrrh0y,Come on spy please dump ![img](emote|t5_2th52|53057)![img](emote|t5_2th52|53057)![img](emote|t5_2th52|53057),18,2025-03-14 16:21,1jb0bwm
comment_in_dd,SPY,mhs277x,spy 556 close. i don’t make the rules,18,2025-03-14 17:12,1jb0bwm
comment_in_dd,TESLA,mhsa8ty,I HATE TESLA PLZ DIE,17,2025-03-14 17:50,1jb0bwm
comment_in_dd,TSLA,mhskpzj,TSLA proving how much the algos have control over the market,19,2025-03-14 18:46,1jb0bwm
comment_in_dd,TSLA,mhskq47,Nothing but bad news about TSLA this week and it rallies this fucking hard bro gimme a mother fucking break man,22,2025-03-14 18:46,1jb0bwm
comment_in_dd,TSLA,mhqc8tc,"#Ban Bet Lost

/u/Odd_University_8727 made a bet that TSLA would go to 0.0 within **1 week** when it was 262.475 and it did not, so they were banned for a week.

Their record is now 0 wins and 1 losses

[**Join WSB Discord**](http://discord.gg/wsbverse)",17,2025-03-14 11:39,1jb0bwm
comment_in_dd,SPY,mhqnm6z,"I sold my spy calls yesterday so we could pump today, have you said thank you once?",17,2025-03-14 12:55,1jb0bwm
comment_in_dd,"SPY,NVDA",mhqsmg9,"How TF is NVDA still pumping. It was at 104 like 2-3 days ago. It’s now approaching 120!!! All this whilst SPY has dipped, having a greater than -1% day yesterday Lmfao. Insane",17,2025-03-14 13:25,1jb0bwm
comment_in_dd,TESLA,mhqsojr,"[Musk says Tesla could be targeted by retaliatory tariffs](https://amp.cnn.com/cnn/2025/03/13/business/elon-musk-tesla-retaliatory-tariffs)   

![img](emote|t5_2th52|4271)![img](emote|t5_2th52|4271)![img](emote|t5_2th52|4271)",17,2025-03-14 13:25,1jb0bwm
comment_in_dd,TESLA,mhqtz3w,Fuck you tesla,17,2025-03-14 13:33,1jb0bwm
comment_in_dd,TSLA,mhqtzq7,"And the award for most manipulated stock goes to…


TSLA!!!",16,2025-03-14 13:33,1jb0bwm
comment_in_dd,TESLA,mhr2c7k,When is the next White House Tesla infomercial?,17,2025-03-14 14:18,1jb0bwm
comment_in_dd,TSLA,mhr2s8r,Why is TSLA still above 240 ![img](emote|t5_2th52|27421),18,2025-03-14 14:20,1jb0bwm
comment_in_dd,TSLA,mhqhcyd,"Elon: Makes Hitler joke.

TSLA: Green in Premarket

🦅🇺🇸🎆",15,2025-03-14 12:16,1jb0bwm
comment_in_dd,TSLA,mhqplsl,TSLA to 230 within 20 min of open. You heard it here first,17,2025-03-14 13:07,1jb0bwm
comment_in_dd,TESLA,mhqsl93,DIE TESLA DIE,18,2025-03-14 13:25,1jb0bwm
comment_in_dd,TSLA,mhr0d0e,"with everything happening to TSLA, you must be really sick in your mind to keep pumping it",16,2025-03-14 14:08,1jb0bwm
comment_in_dd,TSLA,mhr0rpb,BURN TSLA TO THE GROUND,14,2025-03-14 14:10,1jb0bwm
comment_in_dd,SPY,mhr49bk,SPY DUMP ON MY ASS PLEASE NEED $538 NEXT WEEKKKKKKK![img](emote|t5_2th52|53057)![img](emote|t5_2th52|53057)![img](emote|t5_2th52|53057),16,2025-03-14 14:28,1jb0bwm
comment_in_dd,SPY,mhrbxff,"Just bought spy puts, so get ready for record setting green dildos",17,2025-03-14 15:06,1jb0bwm
comment_in_dd,SPY,mhrc7ms,"""Americans sour on economy as inflation expectations hit highest level since 1991"" \~ Yahoo Finance

Also SPY - ![img](emote|t5_2th52|4276)![img](emote|t5_2th52|4276)",16,2025-03-14 15:07,1jb0bwm
comment_in_dd,SPY,mhrrj1q,"🥭 speech begins: *""My fellow Americans......""*


**(SPY -3%)**",18,2025-03-14 16:21,1jb0bwm
comment_in_dd,SPY,mhrrrq0,just dump already SPY geesuz,15,2025-03-14 16:22,1jb0bwm
comment_in_dd,SPY,mhruerp,"SPY is giving you a ton of time to get out of your calls, why are you still holding?",16,2025-03-14 16:35,1jb0bwm
comment_in_dd,SPY,mhsgcut,"SPY is well above max pain 

Get ready to see something hilarious",15,2025-03-14 18:24,1jb0bwm
comment_in_dd,SPY,mhsl5zb,Less than half the daily average volume on SPY. Yeah this pump is so believable LMFAO ![img](emote|t5_2th52|4267)![img](emote|t5_2th52|4271),17,2025-03-14 18:49,1jb0bwm
comment_in_dd,TSLA,mhq5adj,!banbet TSLA -15% 30d,14,2025-03-14 10:41,1jb0bwm
comment_in_dd,TESLA,mhq8q0q,So puts on tesla on open?,15,2025-03-14 11:11,1jb0bwm
comment_in_dd,TESLA,mhqbmoa,All new Tesla will come with a fire extinguisher in every seat and a please no burn sticker,15,2025-03-14 11:34,1jb0bwm
comment_in_dd,TSLA,mhqqt1l,"At market open, lots of money will flow out of american markets into EU-defence businesses.  
Will turn red instantly.  
Keep on shorting TSLA and MSTR!",15,2025-03-14 13:14,1jb0bwm
comment_in_dd,TSLA,mhqs1sr,TSLA 235p 0DTE? ![img](emote|t5_2th52|4275),16,2025-03-14 13:22,1jb0bwm
comment_in_dd,TSLA,mhquhm5,IMAGINE BUYING TSLA ![img](emote|t5_2th52|4267)![img](emote|t5_2th52|4271),16,2025-03-14 13:36,1jb0bwm
comment_in_dd,"SPY,TSLA",mhqwb2x,Spy mooning while TSLA tanking ![img](emote|t5_2th52|4271)![img](emote|t5_2th52|4271),16,2025-03-14 13:46,1jb0bwm
comment_in_dd,TSLA,mhr0l6c,"TSLA going to $230 today

Deserves to be at $20 though",15,2025-03-14 14:09,1jb0bwm
comment_in_dd,TSLA,mhr0w0g,"Imagine being burned to death in a TSLA because the doors wouldn’t open

Computers bro ![img](emote|t5_2th52|4267)",15,2025-03-14 14:10,1jb0bwm
comment_in_dd,TESLA,mhr2lyk,For the love of god why can’t Tesla just die already. Do people not understand how funny it would be if the richest man in the world got margin called?,15,2025-03-14 14:19,1jb0bwm
comment_in_dd,TSLA,mhr5k1p,Tsla bout to drop like a rock lol,15,2025-03-14 14:34,1jb0bwm
comment_in_dd,TSLA,mhraizb,"Horrible consumer sentiment, extremely hated company and CEO, company writing letters asking to stop tariffs 

TSLA still up 1.7% 

Fuck this clown market.",15,2025-03-14 14:59,1jb0bwm
comment_in_dd,SPY,mhrdki6,Guess who bought SPY puts today,16,2025-03-14 15:14,1jb0bwm
comment_in_dd,NVDA,mhrfmt6,we are pumping because of NVDA..lets be real,15,2025-03-14 15:24,1jb0bwm
comment_in_dd,SPY,mhrfnq9,My SPY puts for next week are -70%… there is still… a … chance… right? ![img](emote|t5_2th52|53057)![img](emote|t5_2th52|31225)![img](emote|t5_2th52|31226)![img](emote|t5_2th52|52627),13,2025-03-14 15:24,1jb0bwm
comment_in_dd,SPY,mhrvkz7,3/21 SPY PUT GANG WHERE WE AT!?!? ![img](emote|t5_2th52|8882)![img](emote|t5_2th52|29637)![img](emote|t5_2th52|53057)![img](emote|t5_2th52|52627),15,2025-03-14 16:41,1jb0bwm
comment_in_dd,NVDA,mhsbppw,Already down 89% on these NVDA 219P might as well let em ride to EOD  ![img](emote|t5_2th52|4260)![img](emote|t5_2th52|4267),15,2025-03-14 17:58,1jb0bwm
comment_in_dd,"TSLA,TESLA",mhq4v0b,tsla prolly will go out of business in EU if this hate continues. it's like social stigma riding a tesla nowadays ![img](emote|t5_2th52|12787)![img](emote|t5_2th52|12787)![img](emote|t5_2th52|12787),14,2025-03-14 10:38,1jb0bwm
comment_in_dd,TSLA,mhq7jba,I was told my TSLA puts will print bigly. I'm so fucking bad at this ![img](emote|t5_2th52|4271)![img](emote|t5_2th52|4267),14,2025-03-14 11:01,1jb0bwm
comment_in_dd,TESLA,mhqj7x7,I’m shorting Tesla until the death. It’s this generations Boston Tea Party,18,2025-03-14 12:28,1jb0bwm
comment_in_dd,TSLA,mhqvllr,Send TSLA to 230 today ![img](emote|t5_2th52|4275),15,2025-03-14 13:42,1jb0bwm
comment_in_dd,TESLA,mhqwryn,REMINDER: TESLA SHOULD BE WORTH 25$-40$,13,2025-03-14 13:48,1jb0bwm
comment_in_dd,TSLA,mhr0nh6,"TSLA with -50% sales and cars being vandalized. If you're buying calls on this, you deserve to be poor",15,2025-03-14 14:09,1jb0bwm
comment_in_dd,TSLA,mhr1n0i,TSLA going red is the only good news we have today. I hope it burns to the ground.,14,2025-03-14 14:14,1jb0bwm
comment_in_dd,SPY,mhr1o7u,"Bulls, let me tell you a story of 12:00 pm SPY$550",13,2025-03-14 14:14,1jb0bwm
comment_in_dd,TSLA,mhr1qb9,TSLA dump disgusting ![img](emote|t5_2th52|53057)![img](emote|t5_2th52|53057)![img](emote|t5_2th52|53057),14,2025-03-14 14:15,1jb0bwm
comment_in_dd,TSLA,mhr1vql,who the fck is still pumping tsla up ???????????,14,2025-03-14 14:16,1jb0bwm
comment_in_dd,SPY,mhr4uqe,It’s gonna take a truly unhinged 🥭 rant to get SPY to fucking drop today. It’s flat out refusing to acknowledge how horrible data has been and wants to remain propped up in this range today. No matter the cost ![img](emote|t5_2th52|4267),14,2025-03-14 14:31,1jb0bwm
comment_in_dd,SPY,mhr8tj3,SPY eat shit already enough of this delusion,14,2025-03-14 14:51,1jb0bwm
comment_in_dd,SPY,mhrhkt2,"Nice bul trap SPY, now dump ![img](emote|t5_2th52|53057)![img](emote|t5_2th52|53057)![img](emote|t5_2th52|53057)",13,2025-03-14 15:33,1jb0bwm
comment_in_dd,SPY,mhrljrv,DUMP ALL OVER MY CHEST SPY ![img](emote|t5_2th52|53057)![img](emote|t5_2th52|29637),14,2025-03-14 15:52,1jb0bwm
comment_in_dd,SPY,mhs3agv,"Breaking all my rules *(they were not working anyways)*  Today's run has to be for creating exit liquidity, so bought SPY PUTs for 3/21, 4/17 and 5/16.  Have a nice weekend.",14,2025-03-14 17:17,1jb0bwm
comment_in_dd,SPY,mhs3ezm,Moment of silence for all the 0DTE SPY 550 puts ![img](emote|t5_2th52|4260),14,2025-03-14 17:18,1jb0bwm
comment_in_dd,SPY,mhsh7yo,It’s kinda crazy to watch SPY slowly dip down and then go right back up in seconds - it just does not want to have anything to do with going down today.,14,2025-03-14 18:29,1jb0bwm
comment_in_dd,TSLA,mhq23p2,"world is officially ending, pack your bags

TSLA: +250%: ![img](emote|t5_2th52|4271)![img](emote|t5_2th52|4271)",12,2025-03-14 10:12,1jb0bwm
comment_in_dd,TSLA,mhrast9,"$TSLA down 40% in a month, this person decides to buys puts, then blames the market for their stupidity",23,2025-03-14 15:00,1jb0bwm
comment_in_dd,"NVDA,NVIDIA",mhkxn8c,"Oh man you should see r/nvidiastock and 
r/nvda_stock. Perfect examples of market emotions",5,2025-03-13 15:35,1jadc4s
comment_in_dd,TSLA,mhkqrb7,Changing stages faster than TSLA directions,5,2025-03-13 15:02,1jadc4s
comment_in_dd,TSLA,mhjmb4q,JP Morgan $120 price target on TSLA ![img](emote|t5_2th52|4271)![img](emote|t5_2th52|4271)![img](emote|t5_2th52|4271)![img](emote|t5_2th52|4258)![img](emote|t5_2th52|4258)![img](emote|t5_2th52|4258),222,2025-03-13 10:54,1ja8eyw
comment_in_dd,TESLA,mhjjgcw,"Musk promised robotaxis by 2020. Their FSD keeps hitting things. Their AI robots were remote controlled. Every tesla car model is practically the same. No forward development in years. Rely on cameras instead of good tech like LIDAR.   

Sales down 11% in US, 49% in China. Average of about 50% in Europe.   

Tesla is the definition of a meme stock. It literally goes up or down whenever Musk opens his mouth. Its all promises and no actual delivery.",147,2025-03-13 10:29,1ja8eyw
comment_in_dd,TSLA,mhjnv8z,"I just want to see a -30% candle on TSLA and my life will be complete

Just one",103,2025-03-13 11:07,1ja8eyw
comment_in_dd,TESLA,mhjvhso,DIE TESLA ![img](emote|t5_2th52|4271)![img](emote|t5_2th52|4271)![img](emote|t5_2th52|4271)![img](emote|t5_2th52|4271)![img](emote|t5_2th52|53057)![img](emote|t5_2th52|53057),100,2025-03-13 12:06,1ja8eyw
comment_in_dd,TESLA,mhjnwqp,"I will never understand teslards. The CEO is trying to bilk them out of $50bn, the company hasn't produced a new product in a decade, they rely on financial engineering to show a profit and sales are clearly seriously tanking wordwide. And that's before you even get into the CEO's politics, his repeated lying and how little time he actually spends working there.


What does he do for you? Like I really don't get it. Why would you latch on to him like that?",86,2025-03-13 11:07,1ja8eyw
comment_in_dd,TSLA,mhjl110,"The next TSLA earnings call will be glorious. After a miss on every metric Elmo will recite his PhD dissertation ""Everybody Else's Fault But Mine"" and the stock will go up.",72,2025-03-13 10:43,1ja8eyw
comment_in_dd,TSLA,mhjvhzh,TSLA about to never see $250 again,66,2025-03-13 12:06,1ja8eyw
comment_in_dd,TSLA,mhjkjei,yet another price target cut for tsla ![img](emote|t5_2th52|4271)![img](emote|t5_2th52|4271),64,2025-03-13 10:39,1ja8eyw
comment_in_dd,TESLA,mhjv60s,MORE TARIFFS. LOAD UP ON TESLA PUTS,62,2025-03-13 12:03,1ja8eyw
comment_in_dd,TSLA,mhlzjqj,"Upvote for TSLA 200. 

Downvote for TSLA 300.",53,2025-03-13 18:34,1ja8eyw
comment_in_dd,SPY,mhjoeb0,"\*Looks at Spy chart.

Mmmmm yes, classic squiggle formation. ![img](emote|t5_2th52|12787)",52,2025-03-13 11:12,1ja8eyw
comment_in_dd,TSLA,mhjomay,Trump couldn't afford to pump $TSLA any longer ![img](emote|t5_2th52|4271) back to freefall for Emulsified Dungbeetle,49,2025-03-13 11:13,1ja8eyw
comment_in_dd,TESLA,mhjsmio,"Tesla Forward P/E = 90

Yes, even after that big drop.

It could do a -50% and still be overvalued.

Puts on Tesla

![img](emote|t5_2th52|53057)",43,2025-03-13 11:45,1ja8eyw
comment_in_dd,TSLA,mhkj5e2,tsla die die die die die die PLEASE ![img](emote|t5_2th52|27421)![img](emote|t5_2th52|27421)![img](emote|t5_2th52|27421)![img](emote|t5_2th52|27421)![img](emote|t5_2th52|27421),43,2025-03-13 14:24,1ja8eyw
comment_in_dd,TSLA,mhjiday,"If it doesn't break 250$, we're going down. Buy TSLA Puts you regards",38,2025-03-13 10:19,1ja8eyw
comment_in_dd,TESLA,mhjue0d,But y did he put the hard r on tesla?,34,2025-03-13 11:58,1ja8eyw
comment_in_dd,SPY,mhlrux2,Coulda had mommy kamalas huge knockers holding up SPY 650 but here we are. We got 🥭 the used Tesler salesman.,39,2025-03-13 17:58,1ja8eyw
comment_in_dd,TSLA,mhjsgvr,"If you recently bought TSLA, you dont deserve money.",36,2025-03-13 11:44,1ja8eyw
comment_in_dd,TSLA,mhjlfeg,"Wow, selling all my TSLA stock now. Loved Elon’s political work, had no idea he sold EVs.",39,2025-03-13 10:46,1ja8eyw
comment_in_dd,TSLA,mhjjdwc,How many of you are sweating because you all ined on tsla puts,35,2025-03-13 10:28,1ja8eyw
comment_in_dd,TESLA,mhlsvey,"fucking tesla die , for fucking fucks sake, fucking die ![img](emote|t5_2th52|31225)",30,2025-03-13 18:03,1ja8eyw
comment_in_dd,TESLA,mhjrwl6,We going down. Fuck you Tesla ![img](emote|t5_2th52|4271)![img](emote|t5_2th52|4271)![img](emote|t5_2th52|53057)![img](emote|t5_2th52|53057),30,2025-03-13 11:39,1ja8eyw
comment_in_dd,TESLA,mhjoe76,Tesla 200 EoW,25,2025-03-13 11:11,1ja8eyw
comment_in_dd,TSLA,mhjr2eu,Drill team 6 is getting ready to drive TSLA down…..,28,2025-03-13 11:33,1ja8eyw
comment_in_dd,TESLA,mhjs3hl,Tesla Puts,29,2025-03-13 11:41,1ja8eyw
comment_in_dd,TSLA,mhjt5dd,Shut the fuck up you're saying my tsla puts AREN'T dead???,28,2025-03-13 11:49,1ja8eyw
comment_in_dd,TSLA,mhk2wp9,"Real shit, Cramer saying TSLA is ready to rally? I wonder how much he got paid ![img](emote|t5_2th52|4271)![img](emote|t5_2th52|4271)![img](emote|t5_2th52|4271)",27,2025-03-13 12:54,1ja8eyw
comment_in_dd,TSLA,mhkb8pu,-15% day for TSLA sounds good to me,27,2025-03-13 13:42,1ja8eyw
comment_in_dd,TSLA,mhkg1db,#TSLA LMFAO!!,27,2025-03-13 14:08,1ja8eyw
comment_in_dd,TSLA,mhkqq88,"I ask again

WHO IN THIS ENTIRE MARKET IS SCOOPING UP
TSLA RIGHT NOW?? Let this inflated, corpse of a fake tech company just get a train run on it until it hits double digits. And it’d still be too expensive.",26,2025-03-13 15:01,1ja8eyw
comment_in_dd,S&P 500,mhl5hik,"It’s called the S&P 500, not 600, dumbass. We’re meant to live here.",24,2025-03-13 16:13,1ja8eyw
comment_in_dd,TSLA,mhjobcp,The TSLA exit stampede is going to be epic,24,2025-03-13 11:11,1ja8eyw
comment_in_dd,TSLA,mhjqnab,"oh yeah, TSLA dumping bigly today. i'm selling my puts as soon as they turn green tho lmao",26,2025-03-13 11:30,1ja8eyw
comment_in_dd,TSLA,mhju3ue,"By god, these TSLA puts I bought before close on a whim are going to PRINT",25,2025-03-13 11:55,1ja8eyw
comment_in_dd,TESLA,mhk99ns,DIE TESLA DIE,24,2025-03-13 13:31,1ja8eyw
comment_in_dd,TSLA,mhltonq,"stay the fuck away from buying TSLA. It is manipulated by Thiel etc. otherwise Musk would get margin called and liquidated by his banks (most of his wealth is TSL stock and he 100% leveraged that) - why do you think Mango had to do an extra fucking commercial at the white house. NOONE rational is buying the stock in these amounts in this market with this company outlook and this valuation and it is only worth so much to manipulate the whole thing - once they don't or can't or are not willing anymore, the stock will crash more quickly than you can look, as they won't sell in tranches or won't gradually stop buying, but all at once.",23,2025-03-13 18:07,1ja8eyw
comment_in_dd,TSLA,mhmgmev,Everytime someone sells their TSLA stock a baby smiles.,23,2025-03-13 19:55,1ja8eyw
comment_in_dd,TSLA,mhjgg3o,just crash TsLa already and get this over with margin calls on Musk ,25,2025-03-13 10:00,1ja8eyw
comment_in_dd,TSLA,mhjs70h,Tsla to 2000!!! ![img](emote|t5_2th52|27421) (Russell 2000 ![img](emote|t5_2th52|4275)),21,2025-03-13 11:41,1ja8eyw
comment_in_dd,TSLA,mhjt04g,TSLA didn’t even get back to what it lost on Monday and bulls thought they were saved because a geriatric bought a car,20,2025-03-13 11:47,1ja8eyw
comment_in_dd,TSLA,mhk23rl,"Its been several years since I've joined you folks. We blew up a lot of accounts during covid together. One last run as a gay bear bought me my first house. Now I'm back riding TSLA puts with some of you, apologize in advance for the green. Lets lose a house.",20,2025-03-13 12:49,1ja8eyw
comment_in_dd,TSLA,mhkbznv,Everyone thank Jim Cramer for TSLA dumping today ![img](emote|t5_2th52|8882)![img](emote|t5_2th52|8882)![img](emote|t5_2th52|8882),21,2025-03-13 13:46,1ja8eyw
comment_in_dd,TESLA,mhkfiu5,I’m simple. I just want Tesla gone.,22,2025-03-13 14:05,1ja8eyw
comment_in_dd,TSLA,mhkfva4,If TSLA would have V'd there I would have killed myself,22,2025-03-13 14:07,1ja8eyw
comment_in_dd,TESLA,mhkgqqp,"Imagine being a Tesla bull

![img](emote|t5_2th52|4271)![img](emote|t5_2th52|4271)![img](emote|t5_2th52|4271)",22,2025-03-13 14:11,1ja8eyw
comment_in_dd,TESLA,mhkhfes,DIE TESLA ![img](emote|t5_2th52|4271)![img](emote|t5_2th52|53057),22,2025-03-13 14:15,1ja8eyw
comment_in_dd,TESLA,mhkhg0y,I refuse to believe any human is buying Tesla. Only the lowest form of intelligence would buy that shit,22,2025-03-13 14:15,1ja8eyw
comment_in_dd,TESLA,mhkj121,"When I say Tesla, you say Die. Tesla. Die. Tesla. Die.",20,2025-03-13 14:23,1ja8eyw
comment_in_dd,TSLA,mhkojne,So fucking tired of this bullshit TSLA crap just fucking die already,20,2025-03-13 14:51,1ja8eyw
comment_in_dd,SPY,mhkp76x,Christ SPY just go down already,21,2025-03-13 14:54,1ja8eyw
comment_in_dd,SPY,mhkqqcf,I should make a bot that tracks SPY movement and make it auto send “LMAO BOLS/BERS ![img](emote|t5_2th52|4271)” here based on if it goes up or down. Infinite karma.,22,2025-03-13 15:02,1ja8eyw
comment_in_dd,TSLA,mhktv2t,I just need TSLA to close below $50 by next Friday or I'm broke,20,2025-03-13 15:17,1ja8eyw
comment_in_dd,TESLA,mhl0gk0,"if you're buying Tesla, you are a true regard ![img](emote|t5_2th52|4271)",20,2025-03-13 15:49,1ja8eyw
comment_in_dd,TSLA,mhldu40,wtf fuck you whoever is pumping tsla.,24,2025-03-13 16:52,1ja8eyw
comment_in_dd,TESLA,mhle7ju,Can Tesla just go below $200 already.,20,2025-03-13 16:54,1ja8eyw
comment_in_dd,TSLA,mhln6sn,Whoever is keeping TSLA pinned at 235 is doing a heck of a job. This is legendary work.,23,2025-03-13 17:36,1ja8eyw
comment_in_dd,TESLA,mhlq8cq,WHY WONT YOU DIE TESLA,21,2025-03-13 17:50,1ja8eyw
comment_in_dd,TSLA,mhlsaq0,TSLA price movement is 100% fraudulent,23,2025-03-13 18:00,1ja8eyw
