type,ticker,id,text,score,timestamp,parent_post_id
comment_in_dd,TESLA,m9u9jw3,You’re telling me we’re waiting for a FOMC meeting and Tesla Earnings today to stop the bleeding?! We’re fucking cooked. ![img](emote|t5_2th52|4267)![img](emote|t5_2th52|31226),13,2025-01-29 16:00,1icr8ht
comment_in_dd,NVIDIA,m9ufipd,Nvidia trying to make it to 9/10 biggest single day losses,13,2025-01-29 16:28,1icr8ht
comment_in_dd,NVDA,m9unbqn,Somebody get NVDA a blue chew stat ![img](emote|t5_2th52|4271),13,2025-01-29 17:04,1icr8ht
comment_in_dd,SPY,m9ut2hs,"For everyone that keeps asking, SPY earnings are released at 2 p.m, CEO speech at 2:30 ![img](emote|t5_2th52|4640)",12,2025-01-29 17:30,1icr8ht
comment_in_dd,NVDA,m9uvnqj,If you are buying nvda puts down here you are incredibly regarded,12,2025-01-29 17:42,1icr8ht
comment_in_dd,SPY,m9uyuw5,RAISE HAND IF YOU ARE A DEGEN AND BOUGHT 0DTE SPY PUTS,13,2025-01-29 17:56,1icr8ht
comment_in_dd,NVDA,m9uz8a9,NVDA please I need you above 150 by Friday,12,2025-01-29 17:58,1icr8ht
comment_in_dd,NVDA,m9v0tsx,‘cONgRAtS to ALl tHe NVDA dIpBuYeRs”,12,2025-01-29 18:05,1icr8ht
comment_in_dd,NVDA,m9v2gjl,I keep doubling down on my NVDA calls 😆. This better pay off,12,2025-01-29 18:12,1icr8ht
comment_in_dd,NVDA,m9v3w4y,You can tell that retail piled into NVDA yesterday since it is so red today,13,2025-01-29 18:19,1icr8ht
comment_in_dd,SPY,m9vb17g,Rate hike in 9 mins. SPY 570 in 39 minutes,15,2025-01-29 18:51,1icr8ht
comment_in_dd,SPY,m9vb7zw,"my buddy on wallstreet says they’re prepping for the worst

y’all might want to load spy puts while they’re not +2000% lol

or die poor idc",13,2025-01-29 18:52,1icr8ht
comment_in_dd,SPY,m9ve5pf,I don’t feel so good Mr. SPY,13,2025-01-29 19:05,1icr8ht
comment_in_dd,NVDA,m9vfd4b,Come on NVDA you piece of shit,13,2025-01-29 19:11,1icr8ht
comment_in_dd,NVDA,m9vkab5,SAY NVDA JPOW,13,2025-01-29 19:33,1icr8ht
comment_in_dd,NVIDIA,m9vvajy,ALL IN NVIDIA,15,2025-01-29 20:23,1icr8ht
comment_in_dd,TSLA,m9vyloo,"my brain tells me tsla will tank after earnings.  
my balls tell me it'll go up. 

.in balls we trust.",13,2025-01-29 20:38,1icr8ht
comment_in_dd,TSLA,m9w1oa7,"Meta beat.

MSFT flat or tanks (have to justify OPENAI investment).

TSLA Miss.",13,2025-01-29 20:52,1icr8ht
comment_in_dd,NVDA,m9sy2dk,NVDA to 155 today,12,2025-01-29 11:06,1icr8ht
comment_in_dd,NVDA,m9tgfk8,NVDA GENERATIONAL RAGPALL INCOMING,12,2025-01-29 13:25,1icr8ht
comment_in_dd,NVDA,m9tr4fw,NVDA COME ON BABE GET YOUR ASS UP ITS SHOWTIME,13,2025-01-29 14:27,1icr8ht
comment_in_dd,NVDA,m9trd80,NVDA looks ready to leap in either direction,14,2025-01-29 14:28,1icr8ht
comment_in_dd,NVDA,m9trf2m,NVDA about to PUMP,12,2025-01-29 14:28,1icr8ht
comment_in_dd,NVDA,m9tsc3a,NVDA 130+ today,12,2025-01-29 14:33,1icr8ht
comment_in_dd,NVDA,m9u1u85,"#Ban Bet Lost

/u/Fun-Craft-6136 made a bet that NVDA would go to 100.0 within **1 day** when it was 120.032 and it did not, so they were banned for a week.

Their record is now 0 wins and 20 losses

[**Join WSB Discord**](http://discord.gg/wsbverse)",12,2025-01-29 15:22,1icr8ht
comment_in_dd,NVDA,m9u2mzo,Nvda you piece of shit it’s fucking everything up today,11,2025-01-29 15:26,1icr8ht
comment_in_dd,NVDA,m9u45il,Lmao all those NVDA bulls real quiet today. SHOW US THAT LOSS PORN ![img](emote|t5_2th52|4271)![img](emote|t5_2th52|4271)![img](emote|t5_2th52|4271),12,2025-01-29 15:34,1icr8ht
comment_in_dd,NVDA,m9u46n5,NVDA wtf u doing bitch,12,2025-01-29 15:34,1icr8ht
comment_in_dd,NVDA,m9u4dlx,"Ok NVDA, time to trap the bears who think they can still join the party from the weekend  ![img](emote|t5_2th52|4267)![img](emote|t5_2th52|4271)![img](emote|t5_2th52|4271)![img](emote|t5_2th52|4271)",12,2025-01-29 15:35,1icr8ht
comment_in_dd,NVDA,m9u6aru,Cramer told people to buy NVDA yesterday afternoon. ![img](emote|t5_2th52|4271)![img](emote|t5_2th52|4271)![img](emote|t5_2th52|4271)![img](emote|t5_2th52|53057),11,2025-01-29 15:44,1icr8ht
comment_in_dd,NVDA,m9u6rzh,Generational dip on nvda again😂,12,2025-01-29 15:47,1icr8ht
comment_in_dd,NVDA,m9u7nvm,NVDA green EOD,13,2025-01-29 15:51,1icr8ht
comment_in_dd,NVIDIA,m9u9mc2,You liked Nvidia at $120? You'll love it at $110,11,2025-01-29 16:00,1icr8ht
comment_in_dd,NVDA,m9ug30y,If NVDA hits that 117/118 sweet spot again - - - buy buy buy,12,2025-01-29 16:30,1icr8ht
comment_in_dd,"TSLA,TESLA",m9uiyd9,"TSLA bulls out here like ‘I did Nazi that coming’ while their portfolio gets margin-called harder than a leveraged YOLO on earnings. -25% LTVs should’ve been your first clue, but nah, y’all were too busy simping for Daddy Elon. Inventory lots stacked so high you can see them from space—looking like Tesla built a second Gigafactory just to store the unsold bagholder-mobiles. Stay poor, Wendy’s interns.",12,2025-01-29 16:44,1icr8ht
comment_in_dd,NVDA,m9uolvs,"NVDA pls fly again, preferably before Feb 7 thanks",12,2025-01-29 17:10,1icr8ht
comment_in_dd,TSLA,m9uskt1,"Last 6 tsla earnings movements 

23-Oct-2024. +21.9%

23-Jul-2024.  -12.3%

23-Apr-2024   +12.1%

24-Jan-2024. -12.1%

18-Oct-2023. -9.3%

19-Jul-2023.  -9.7%",12,2025-01-29 17:28,1icr8ht
comment_in_dd,NVDA,m9v0zmc,"JPow gonna say ""we use NVDA chips in our money printers""",13,2025-01-29 18:06,1icr8ht
comment_in_dd,NVDA,m9v29fx,"NVDA dumps 16%  
NVDA pumps 8%: yesterday was fake  
NVDA dumps 5%: no, no. yesterday's fakeout was fake.  
rinse and repeat",13,2025-01-29 18:11,1icr8ht
comment_in_dd,SPY,m9v4s1f,"CEO of SPY coming to do the earnings call today ![img](emote|t5_2th52|12787)

Don’t know if you heard",11,2025-01-29 18:23,1icr8ht
comment_in_dd,SPY,m9v7vua,Not sure which way we go. Jacked to the tits with 0DTE SPY strangles rn. Imagine if we stayed flat ![img](emote|t5_2th52|4271)![img](emote|t5_2th52|4267),11,2025-01-29 18:37,1icr8ht
comment_in_dd,SPY,m9v9d2c,Spy puts before JPow opened his mouth is the easiest money ever.,11,2025-01-29 18:43,1icr8ht
comment_in_dd,NVIDIA,m9vrog6,"NVIDIA stop playing with my feelings, go up",12,2025-01-29 20:07,1icr8ht
comment_in_dd,TESLA,m9t8zxl,All my homies hate Elon and Tesla,15,2025-01-29 12:36,1icr8ht
comment_in_dd,NVIDIA,m9mbzdn,"Still laughing at that NVidia call guy closing his position yesterday at a 72% loss 

Bro had an entire month left",185,2025-01-28 11:32,1ibz0cd
comment_in_dd,NVDA,m9mrw0j,"NVDA is dead, they can’t compete with Chinese, these guy built a wall like 4000 years ago meanwhile US still trying to figure out how to do it",83,2025-01-28 13:28,1ibz0cd
comment_in_dd,NVDA,m9m8z01,RIP to the guy who sold his NVDA calls with a month to go…,45,2025-01-28 11:04,1ibz0cd
comment_in_dd,NVIDIA,m9mjc40,"Cramer is talking smack about Deepseek while being bullish about Nvidia and rest of big tech. 

We are doomed..",39,2025-01-28 12:31,1ibz0cd
comment_in_dd,NVDA,m9merba,NVDA calls at close were the play,32,2025-01-28 11:55,1ibz0cd
comment_in_dd,SPY,m9mp4m4,"We begin today at SPY 600, we end today at SPY 600",29,2025-01-28 13:11,1ibz0cd
comment_in_dd,NVDA,m9md5h0,Cant believe we got a 20% sale oj NVDA over a story printed in China LMAO,26,2025-01-28 11:42,1ibz0cd
comment_in_dd,"NVDA,NVIDIA",m9mst9l,"$NVDA - RETAIL INVESTORS BOUGHT RECORD $562.18 MLN NVIDIA STOCK DURING MONDAY'S DEEPSEEK-LED ROUT - VANDA RESEARCH

![img](emote|t5_2th52|4275)![img](emote|t5_2th52|4271)![img](emote|t5_2th52|4271)![img](emote|t5_2th52|4271)![img](emote|t5_2th52|4271)![img](emote|t5_2th52|4271)![img](emote|t5_2th52|4271)![img](emote|t5_2th52|4271)![img](emote|t5_2th52|4271)![img](emote|t5_2th52|4271)![img](emote|t5_2th52|4271)![img](emote|t5_2th52|4271)![img](emote|t5_2th52|4271)![img](emote|t5_2th52|4271)![img](emote|t5_2th52|4267)![img](emote|t5_2th52|4267)![img](emote|t5_2th52|4267)![img](emote|t5_2th52|4267)![img](emote|t5_2th52|4267)![img](emote|t5_2th52|4267)![img](emote|t5_2th52|4267)![img](emote|t5_2th52|4267)![img](emote|t5_2th52|4267)![img](emote|t5_2th52|4267)![img](emote|t5_2th52|4267)![img](emote|t5_2th52|4267)![img](emote|t5_2th52|4267)![img](emote|t5_2th52|4267)",24,2025-01-28 13:34,1ibz0cd
comment_in_dd,NVDA,m9mrysn,Feel like NVDA pre-market at $122 is big players pumping it to get out when market opens. Then the price drops back to $117 during the day,23,2025-01-28 13:29,1ibz0cd
comment_in_dd,NVDA,m9mxsxu,"NVDA will back to $150 soon, If u all stop touching yourself ![img](emote|t5_2th52|4275)",22,2025-01-28 14:04,1ibz0cd
comment_in_dd,NVDA,m9mukh6,guys remember when 177 nvda calls guy sold yesterday at s 127k loss lol when he had a month left till expiration,21,2025-01-28 13:45,1ibz0cd
comment_in_dd,NVIDIA,m9n3poq,WHY DONT WE JUST MAKE AN AI TO PUMP NVIDIA,21,2025-01-28 14:37,1ibz0cd
comment_in_dd,NVIDIA,m9o1wmv,Nvidia was the number 1 stock then lost 1/5 of its value and people thought it would keep dropping? ![img](emote|t5_2th52|4271) bers deserve to lose money on puts,19,2025-01-28 17:23,1ibz0cd
comment_in_dd,NVDA,m9o76h3,"I know for a fact that if I sell my NVDA calls right now for 20% profit next week they’re gonna be at 200%.

But if I hold I’m gonna go red ![img](emote|t5_2th52|12787)",21,2025-01-28 17:47,1ibz0cd
comment_in_dd,NVDA,m9obffl,Imagine looking at the NVDA panic yesterday and not claiming your free money,22,2025-01-28 18:06,1ibz0cd
comment_in_dd,SPY,m9pbbpp,Spy 598 open tomorrow,18,2025-01-28 20:50,1ibz0cd
comment_in_dd,NVIDIA,m9m9qfj,"Nvidia calls were so free, that's why I didn't buy any![img](emote|t5_2th52|4271)",21,2025-01-28 11:11,1ibz0cd
comment_in_dd,NVDA,m9mcway,I bought 5DTE NVDA $115P yesterday at open. Am I regarded?,21,2025-01-28 11:40,1ibz0cd
comment_in_dd,NVDA,m9mdpal,Dipping my toes back into NVDA... 🥷,20,2025-01-28 11:47,1ibz0cd
comment_in_dd,NVDA,m9mro7d,Where my NVDA soldiers at,21,2025-01-28 13:27,1ibz0cd
comment_in_dd,NVDA,m9n155a,NVDA soldiers reporting for duty 🫡 today we ride,21,2025-01-28 14:22,1ibz0cd
comment_in_dd,NVDA,m9n5gpr,A second plane has just hit NVDA,18,2025-01-28 14:46,1ibz0cd
comment_in_dd,NVDA,m9o2iuv,Your brain deserves to be studied if you bought NVDA puts after a -17% day ![img](emote|t5_2th52|4267)![img](emote|t5_2th52|4271),19,2025-01-28 17:26,1ibz0cd
comment_in_dd,NVDA,m9o45fq,"You are telling me that you didn't buy the best positioned AI stock because someone made a model using their GPUs 

Stay poor forever NVDA bears",18,2025-01-28 17:33,1ibz0cd
comment_in_dd,NVIDIA,m9o69c8,"“AI is fucked”

Nvidia down, AMD ( who was already declared unable to do AI, down)

“TSMC is fucked”

Nvidia down, AMD down, Intel with all their domestic fabs, down.

Nvidia recovery today![img](emote|t5_2th52|4271)

AMD & Intel: ![img](emote|t5_2th52|27421)![gif](emote|free_emotes_pack|table_flip)",18,2025-01-28 17:43,1ibz0cd
comment_in_dd,NVDA,m9o88j2,Nvda keep going u crazy son of a bitch 🫡🫡,17,2025-01-28 17:52,1ibz0cd
comment_in_dd,NVDA,m9o8rcj,Let’s ride NVDA to 150 who’s with me?,17,2025-01-28 17:54,1ibz0cd
comment_in_dd,NVDA,m9odls1,NVDA lost 500B in one day and you bought puts for the next day?,18,2025-01-28 18:16,1ibz0cd
comment_in_dd,NVDA,m9om4te,What an awesome day to be alive thanks NVDA,19,2025-01-28 18:55,1ibz0cd
comment_in_dd,NVDA,m9mq9ku,nvda $130 EOW,17,2025-01-28 13:18,1ibz0cd
comment_in_dd,NVDA,m9ms8z8,"NVDA crossing the 200day MA as a mega cap is all you should need to see, that’s a buy all day.",16,2025-01-28 13:31,1ibz0cd
comment_in_dd,NVDA,m9n3pup,"# NVDA send help

#",17,2025-01-28 14:37,1ibz0cd
comment_in_dd,NVDA,m9ok4oa,100% tariffs on their chipmaker is bullish for Nvda![img](emote|t5_2th52|4276),17,2025-01-28 18:46,1ibz0cd
comment_in_dd,NVDA,m9osb45,NVDA please end the day at 130 ![img](emote|t5_2th52|31225),18,2025-01-28 19:23,1ibz0cd
comment_in_dd,NVIDIA,m9mblbt,"Good Morning Bag holders

“RETAIL INVESTORS BOUGHT RECORD $562.18 MLN NVIDIA STOCK DURING MONDAY’S DEEPSEEK-LED ROUT - VANDA RESEARCH”

Walter bloomberg",15,2025-01-28 11:28,1ibz0cd
comment_in_dd,NVDA,m9mf62x,"No bad news on DeepSeek over night, so NVDA is a pure gamble today",17,2025-01-28 11:59,1ibz0cd
comment_in_dd,NVDA,m9mozvi,How my NVDA 140c lookin,17,2025-01-28 13:10,1ibz0cd
comment_in_dd,NVIDIA,m9mp9b9,Looks like NVIDIA will rip,16,2025-01-28 13:12,1ibz0cd
comment_in_dd,NVDA,m9mtao4,This entire sub will short NVDA at 110 and go long at 150 ![img](emote|t5_2th52|4271)![img](emote|t5_2th52|4271)![img](emote|t5_2th52|4271),18,2025-01-28 13:37,1ibz0cd
comment_in_dd,NVDA,m9mv6pr,I bought calls on NVDA yesterday and therefore would like to see NVDA go up,17,2025-01-28 13:48,1ibz0cd
comment_in_dd,NVDA,m9nvsiy,Its kinda insane people thought NVDA could end up red the day after a 17% drop,16,2025-01-28 16:54,1ibz0cd
comment_in_dd,NVDA,m9o1hau,![img](emote|t5_2th52|4276)![img](emote|t5_2th52|4276)![img](emote|t5_2th52|4276)NVDA 4K![img](emote|t5_2th52|4276)![img](emote|t5_2th52|4276)![img](emote|t5_2th52|4276),14,2025-01-28 17:21,1ibz0cd
comment_in_dd,NVDA,m9o1yjv,A moment of silence for the regards that bought NVDA puts at the bottom ![img](emote|t5_2th52|12787),16,2025-01-28 17:23,1ibz0cd
comment_in_dd,NVDA,m9o3wfb,guys remember when 177 nvda calls guy sold yesterday at a 127k loss lol when he had a month left till expiration,16,2025-01-28 17:32,1ibz0cd
comment_in_dd,NVDA,m9o4ryy,We're gonna get a lot of posts tomorrow asking if its too late to buy the NVDA dip lmao,15,2025-01-28 17:36,1ibz0cd
comment_in_dd,NVDA,m9o4uzd,My 100 shares on NVDA with $118 average is happy ![img](emote|t5_2th52|4258),15,2025-01-28 17:37,1ibz0cd
comment_in_dd,NVDA,m9o6ldc,Breaking News: NVDA is gonna buy China.,17,2025-01-28 17:44,1ibz0cd
comment_in_dd,NVDA,m9o8r8o,"So how about this. The reason nvda CEO was so gracious in his comments on deepseek is because he knows, like many have speculated, that it was achieved using nvda hardware. And that’s good for business",16,2025-01-28 17:54,1ibz0cd
comment_in_dd,NVDA,m9p3vhl,"Living dangerously tonight. Holding these fucken NVDA calls. 

  
You're goddamn right I'm in a cult![img](emote|t5_2th52|4276)![img](emote|t5_2th52|8882)",15,2025-01-28 20:16,1ibz0cd
comment_in_dd,NVIDIA,m9p50cf,"Another Nvidia W literally

https://preview.redd.it/0rg8gneymsfe1.png?width=212&format=png&auto=webp&s=3fd4a5f23f3cf6c984ea5e91c67cbb267bb37e86",17,2025-01-28 20:21,1ibz0cd
comment_in_dd,TESLA,m9pccg9,"Tomorrow we have FOMC and earnings from tesla, microsoft, and meta.  The regard Super Bowl.",15,2025-01-28 20:55,1ibz0cd
comment_in_dd,NVDA,m9m92l9,"Still too many broke fruitcakes that came in and bought atm/otm calls at the top near end November, bul gang will be held back until those new regards can no longer financially recover  
  
In other news, NVDA pleas fly again",16,2025-01-28 11:05,1ibz0cd
comment_in_dd,NVIDIA,m9mjtal,Turnip really woke up yesterday and said I’m gonna play golf and then threaten NVIDIA with tariffs,16,2025-01-28 12:35,1ibz0cd
comment_in_dd,NVDA,m9moya1,WE ARE ALL BUYING NVDA.,16,2025-01-28 13:10,1ibz0cd
comment_in_dd,NVDA,m9mrmno,Either nvda will go down a lot or go up a lot today. Or maybe crab. Who knows,15,2025-01-28 13:27,1ibz0cd
comment_in_dd,NVIDIA,m9mumny,"RETAIL INVESTORS BOUGHT RECORD $562.18 MLN NVIDIA STOCK DURING MONDAY’S DEEPSEEK-LED ROUT

guys are my calls fucked?",14,2025-01-28 13:45,1ibz0cd
comment_in_dd,NVDA,m9mxr09,"I know you see NVDA up a bit green pre-market.

I know this.

You have to ask yourself though.

Is it really gonna be that easy?",16,2025-01-28 14:03,1ibz0cd
comment_in_dd,NVDA,m9n4sx8,Nice to see NVDA permabulls getting a proper ass whoopin for once,15,2025-01-28 14:42,1ibz0cd
comment_in_dd,NVDA,m9nfl4k,"In 2011 in my freshmen year of college I debated investing $2000 I got from bonds bought for me as a kid into NVDA because i thought project SHIELD, basically an early steam deck, would make them a ton of profit. 

I didn’t do that. I bought alcohol and weed for two years and a pair of really nice speakers. Also quite a lot of acid. It wasn’t “art school” but it had very prestigious arts/music/dance/acting conservatories. 

That one hurts a lot.",16,2025-01-28 15:37,1ibz0cd
comment_in_dd,NVIDIA,m9nhd99,"If you dumped your NVIDIA, move to China and relinquish your American citizenship. ![img](emote|t5_2th52|4267)",15,2025-01-28 15:46,1ibz0cd
comment_in_dd,SPY,m9nmfnu,"SPY going back to ATHs in the face of tariffs, deepseek, FOMC meetings, and government funding being stopped.

Bers literally cannot win ![img](emote|t5_2th52|4271)![img](emote|t5_2th52|4271)![img](emote|t5_2th52|4271)![img](emote|t5_2th52|4271)![img](emote|t5_2th52|4267)![img](emote|t5_2th52|4267)![img](emote|t5_2th52|4267)![img](emote|t5_2th52|4267)",16,2025-01-28 16:10,1ibz0cd
comment_in_dd,NVDA,m9nzokq,A live look at NVDA bers 👉 🤡🤡🤡🤡🤡🤡🤡🤡🤡🤡🤡🤡🤡,15,2025-01-28 17:13,1ibz0cd
comment_in_dd,NVDA,m9o12c0,Buying that NVDA fear was the play ![img](emote|t5_2th52|4276)![img](emote|t5_2th52|4276),16,2025-01-28 17:19,1ibz0cd
comment_in_dd,NVDA,m9o13ie,NVDA bulls rise up! ![img](emote|t5_2th52|4276),15,2025-01-28 17:19,1ibz0cd
comment_in_dd,NVIDIA,m9o17jn,\*BLOOMBERG: PRES TRUMP ANNOUNCES PLAN TO RENAME MOUNT MCKINLEY TO MOUNT NVIDIA,15,2025-01-28 17:20,1ibz0cd
comment_in_dd,NVDA,m9o2s9j,What if this is the start of the NVDA V for the god candle to $200,16,2025-01-28 17:27,1ibz0cd
comment_in_dd,NVDA,m9o776j,There's just no stopping NVDA is there lol,14,2025-01-28 17:47,1ibz0cd
comment_in_dd,NVDA,m9o9r0y,NVDA preparing to launch again lol,14,2025-01-28 17:59,1ibz0cd
comment_in_dd,NVDA,m9ob26b,NVDA dumped 17% in a day means it can pump 17% in a day. I'm buying calls at the top ![img](emote|t5_2th52|4276),16,2025-01-28 18:05,1ibz0cd
comment_in_dd,NVDA,m9os7e6,People really bought puts when NVDA dropped -17% yesterday ![img](emote|t5_2th52|4640),15,2025-01-28 19:23,1ibz0cd
comment_in_dd,NVDA,m9os8tw,Market pumping NVDA and forgot about the AMD at the corner ![img](emote|t5_2th52|31225),17,2025-01-28 19:23,1ibz0cd
comment_in_dd,NVDA,m9ossjw,NVDA could honestly rip through $130 today lol,14,2025-01-28 19:25,1ibz0cd
comment_in_dd,NVDA,m9oydb2,That NVDA dip was god's gift . ![img](emote|t5_2th52|4258),16,2025-01-28 19:51,1ibz0cd
comment_in_dd,NVDA,m9pb3x6,Gonna hold my NVDA calls ![img](emote|t5_2th52|4271) dear lord can’t wait to see what 🥭 is gonna do,16,2025-01-28 20:49,1ibz0cd
comment_in_dd,NVDA,m9pc2jd,You panic sold NVDA at the bottom 🫵🤡,15,2025-01-28 20:54,1ibz0cd
comment_in_dd,NVDA,m9pdim2,NVDA ripping at the last minute..lmao,16,2025-01-28 21:00,1ibz0cd
comment_in_dd,NVDA,m9m9cs4,Would have all inned 10x bull nvda yesterday. To bad i lost my inheritance and got 0 dollars in my bank account.,12,2025-01-28 11:08,1ibz0cd
comment_in_dd,NVDA,m9n6av8,NVDA 125c bros ![img](emote|t5_2th52|4267)![img](emote|t5_2th52|4271),15,2025-01-28 14:50,1ibz0cd
comment_in_dd,NVDA,m9n9a7c,Nvda to 130 today please ![img](emote|t5_2th52|18630)![img](emote|t5_2th52|4276)![img](emote|t5_2th52|18630)![img](emote|t5_2th52|18630)![img](emote|t5_2th52|18630),15,2025-01-28 15:06,1ibz0cd
comment_in_dd,NVDA,m9naxb3,Show these NVDA virgin bulls what a v sharped recovery looks like. NVDA 135 eow,14,2025-01-28 15:14,1ibz0cd
comment_in_dd,SPY,m9nlzsf,"Well, we had a good run, USA

*SPY near all-time-highs*

Yep. Sad to see it all gone",13,2025-01-28 16:08,1ibz0cd
comment_in_dd,NVDA,m9nzsth,Seriously which of you didn’t buy this $NVDA dip?,14,2025-01-28 17:13,1ibz0cd
comment_in_dd,NVDA,m9nzz8y,"If you liked $NVDA at $118, you'll love $NVDA at $125 ![img](emote|t5_2th52|4271)",13,2025-01-28 17:14,1ibz0cd
comment_in_dd,NVDA,m9o1oa8,NVDA at 118 was a gift from Gyna,14,2025-01-28 17:22,1ibz0cd
comment_in_dd,NVDA,m9o1wl5,$NVDA is angry ![img](emote|t5_2th52|4276),14,2025-01-28 17:23,1ibz0cd
comment_in_dd,NVDA,m9o2pf0,NVDA is so back ![img](emote|t5_2th52|4271),14,2025-01-28 17:27,1ibz0cd
comment_in_dd,NVDA,m9o49f5,# NVDA Gang Members Checking In!,13,2025-01-28 17:34,1ibz0cd
comment_in_dd,NVDA,m9o4ri0,Nvda 200 1/27 leap and chill,14,2025-01-28 17:36,1ibz0cd
comment_in_dd,NVDA,m9o9nsu,Imagine not buying NVDA calls yesterday,14,2025-01-28 17:58,1ibz0cd
comment_in_dd,NVDA,m9oyv35,"you thought NVDA was dead ![img](emote|t5_2th52|4271)![img](emote|t5_2th52|4271)

by something that was made in China ![img](emote|t5_2th52|4271)![img](emote|t5_2th52|4271)",14,2025-01-28 19:53,1ibz0cd
comment_in_dd,NVIDIA,m9pde2j,That huge NVIDIA shrek at the last second ![img](emote|t5_2th52|4276),14,2025-01-28 21:00,1ibz0cd
comment_in_dd,NVIDIA,m9mfiut,"Nvidias 2 biggest obstacles:

Donald Dump and a startup somewhere in China ![img](emote|t5_2th52|4271)",13,2025-01-28 12:02,1ibz0cd
comment_in_dd,NVDA,m9mfsty,"Great, NVDA gonna bleed until open and dump huh.",14,2025-01-28 12:04,1ibz0cd
comment_in_dd,NVDA,m9mlkgt,Anyone else slurped nvda calls at close yesterday ?,13,2025-01-28 12:47,1ibz0cd
comment_in_dd,NVDA,m9mn0ro,"NVDA dip purchased, will sell at $150

This has been the play since July and you cucks keep missing it ![img](emote|t5_2th52|4267)![img](emote|t5_2th52|4271)",12,2025-01-28 12:57,1ibz0cd
comment_in_dd,SPY,m9mxt2u,"🥭 has announced his intent to impose import tariffs as high as 100% on computer chips and semiconductors. He also suggested he would remove Joe Biden’s program of paying subsidies to chip makers like Intel or TSMC to build fabrication plants in the U.S.

SPY back to 550 ![img](emote|t5_2th52|4267)![img](emote|t5_2th52|4271)",12,2025-01-28 14:04,1ibz0cd
comment_in_dd,NVDA,m9n3erw,NVDA lmfao. shit stock,14,2025-01-28 14:35,1ibz0cd
comment_in_dd,NVDA,m9n3p1z,NVDA dragging everyone down ![img](emote|t5_2th52|27421)![img](emote|t5_2th52|27421),15,2025-01-28 14:36,1ibz0cd
comment_in_dd,NVDA,m9n46l9,"Cramer said get out of NVDA!

CALLS!!!!",13,2025-01-28 14:39,1ibz0cd
comment_in_dd,NVDA,m9n5ve0,Where’s the dude who bought $53k of NVDA 130c weeklies ![img](emote|t5_2th52|4640),14,2025-01-28 14:48,1ibz0cd
comment_in_dd,NVDA,m9n65iz,"C’mon NVDA, get up. You can do it lil buddy.",13,2025-01-28 14:49,1ibz0cd
comment_in_dd,NVDA,m9na7w4,"I’m going back to sleep, can you guys watch NVDA for me and make sure it doesn’t go red please? Thank you",13,2025-01-28 15:11,1ibz0cd
comment_in_dd,SPY,m9nf9eg,Switched from puts to calls don’t drop it now spy,13,2025-01-28 15:36,1ibz0cd
comment_in_dd,NVDA,m9nl6v5,NVDA not really inspiring confidence at the moment,14,2025-01-28 16:04,1ibz0cd
comment_in_dd,NVDA,m9nlfv8,NVDA should be up more,12,2025-01-28 16:05,1ibz0cd
comment_in_dd,NVDA,m9nnxlh,The volume on NVDA is nuts,12,2025-01-28 16:17,1ibz0cd
comment_in_dd,NVDA,m9nxn5u,NVDA going ballistic rn,13,2025-01-28 17:02,1ibz0cd
comment_in_dd,NVDA,m9nzccu,NVDA closing at 130,14,2025-01-28 17:11,1ibz0cd
comment_in_dd,NVDA,m9o0q7u,NVDA 130 EOD,14,2025-01-28 17:17,1ibz0cd
comment_in_dd,SPY,m9o1gxf,Imagine downloading Chinese spyware ![img](emote|t5_2th52|4271)![img](emote|t5_2th52|4271),14,2025-01-28 17:21,1ibz0cd
comment_in_dd,NVDA,m9o1stv,"NVDA dip buyers are so tired of winning, it’s a real fatigue.  ![img](emote|t5_2th52|4276)![img](emote|t5_2th52|4276)![img](emote|t5_2th52|4276)![img](emote|t5_2th52|4276)",13,2025-01-28 17:22,1ibz0cd
comment_in_dd,NVDA,m9o2x6e,"Absolutely massive volume on NVDA, already ~33% over average",13,2025-01-28 17:28,1ibz0cd
comment_in_dd,NVDA,m9o5vb8,# NVDA NVDA NVDA NVDA NVDA NVDA NVDA NVDA NVDA NVDA NVDA NVDA NVDA NVDA NVDA NVDA NVDA NVDA NVDA NVDA NVDA NVDA NVDA NVDA NVDA NVDA NVDA NVDA NVDA NVDA NVDA NVDA NVDA,13,2025-01-28 17:41,1ibz0cd
comment_in_dd,NVDA,m9o80x3,If NVDA finishes at 125 today are we actually gonna feel disappointed though? This stock has barely moved this past year. A 5% increase in one day is good. Patience and diamond hands everyone,11,2025-01-28 17:51,1ibz0cd
comment_in_dd,NVDA,m9ob1ie,NVDA going insane lol I love it,14,2025-01-28 18:05,1ibz0cd
comment_in_dd,NVDA,m9oepnr,"Who could've possibly predicted NVDA would recover after a historic single-day drop?

  
Bulls, that's fuckin' who",12,2025-01-28 18:21,1ibz0cd
comment_in_dd,NVDA,m9of4gm,NVDA calls were the easiest money play this week.,13,2025-01-28 18:23,1ibz0cd
comment_in_dd,NVDA,m9oi2d1,NVDA 140 by Friday?,12,2025-01-28 18:36,1ibz0cd
comment_in_dd,NVIDIA,m9om1a5,That nvidia dip yesterday was tasty,13,2025-01-28 18:54,1ibz0cd
comment_in_dd,NVDA,m9orh48,Imagine not buying NVDA ![img](emote|t5_2th52|4271)![img](emote|t5_2th52|4271)![img](emote|t5_2th52|4271)![img](emote|t5_2th52|4271)![img](emote|t5_2th52|4271)![img](emote|t5_2th52|4271)![img](emote|t5_2th52|4271)![img](emote|t5_2th52|4271)![img](emote|t5_2th52|4271)![img](emote|t5_2th52|4271)![img](emote|t5_2th52|4271)![img](emote|t5_2th52|4271)![img](emote|t5_2th52|4271)![img](emote|t5_2th52|4271)![img](emote|t5_2th52|4271)![img](emote|t5_2th52|4271)![img](emote|t5_2th52|4271)![img](emote|t5_2th52|4271)![img](emote|t5_2th52|4271)![img](emote|t5_2th52|4271)![img](emote|t5_2th52|4271)![img](emote|t5_2th52|4271)![img](emote|t5_2th52|4271)![img](emote|t5_2th52|4271)![img](emote|t5_2th52|4271)![img](emote|t5_2th52|4271)![img](emote|t5_2th52|4271)![img](emote|t5_2th52|4271)![img](emote|t5_2th52|4271)![img](emote|t5_2th52|4271)![img](emote|t5_2th52|4271)![img](emote|t5_2th52|4271)![img](emote|t5_2th52|4271)![img](emote|t5_2th52|4271)![img](emote|t5_2th52|4271)![img](emote|t5_2th52|4271)![img](emote|t5_2th52|4271)![img](emote|t5_2th52|4271)![img](emote|t5_2th52|4271)![img](emote|t5_2th52|4271)![img](emote|t5_2th52|4271)![img](emote|t5_2th52|4271)![img](emote|t5_2th52|4271),14,2025-01-28 19:19,1ibz0cd
comment_in_dd,NVDA,m9oth63,Where’s the guy who said nvda 110?,13,2025-01-28 19:28,1ibz0cd
comment_in_dd,NVDA,m9oz3gn,"NVDA down 17% ane bers be like ""now I buy puts"" ![img](emote|t5_2th52|4271)![img](emote|t5_2th52|4267)",13,2025-01-28 19:54,1ibz0cd
comment_in_dd,NVIDIA,m9pbl3h,I'm a simple bull. I buy Nvidia when its cheap and sell it when its high. Free money.,13,2025-01-28 20:52,1ibz0cd
